id,name,shares,likes,loves,wow,cares,sad,angry,haha,reactions_count,comments,Summary,posted_on,video_url,image_url,url,positive_reactions,negative_reactions,Sentiment Analysis
pfbid0xQhhZ1ziVDRPHkwsjiAL2y85wyhngKAoTHZk1ZdALba1yg2s5dcRSkekhaCMuW86l,OpenAI,284,1300,133,109,0,0,0,0,1542,677,"We're releasing an API for accessing new AI models developed by OpenAI. You can ""program"" the API in natural language with just a few examples of your task. See how companies are using the API today, or join our waitlist: https://beta.openai.com",2020-06-11T00:00:00,['blob:https://www.facebook.com/ff5bbd02-01b8-4487-9950-d90fe796d2e2'],https://scontent.fcai19-7.fna.fbcdn.net/v/t15.13418-10/103479749_631282460792212_6062680365921539734_n.jpg?stp=dst-jpg_p180x540&_nc_cat=110&ccb=1-7&_nc_sid=ad6a45&_nc_ohc=JQt7smEbqr8AX_KclUO&_nc_ht=scontent.fcai19-7.fna&oh=00_AfB2FPjUVnLwOlHr0wcc6XLHDllfNSTLtmZpJB5Yh3QY3A&oe=64CDC484,https://www.facebook.com/openai.research/posts/pfbid0xQhhZ1ziVDRPHkwsjiAL2y85wyhngKAoTHZk1ZdALba1yg2s5dcRSkekhaCMuW86l?__cft__[0]=AZUGFlaeG3CUflMgDGoZXOkHzR8riGLLNrFZCJyX-43lyKLIiPj41movRrWyIGQvXnEugQa9ncDlh1ZP_P4FIgVOWwLHEOVdZ1D7F8imr5Z_74Pd0EAaw9nk36ROdIpopJB8eHIwVAPmbypPIpFmGNw5Ph9sqX5_Sfj12Pu1S3H7OZIit4bCfP0mPXzj9lrWbq0-g0urZrdqIXSHa5T2WSZyTYkylYdrdcLUl02B1F95sA&__tn__=%2CO%2CP-R,1826,0,positive
pfbid0GXCKewL7k9Qsmdp5i2ggLWgtXw5GW1ZSNSPBp6WYrLzsSh9RUJmcLPfLqFP5ELZHl,OpenAI,33,510,36,0,0,0,0,0,546,79,"Since 2012, the amount of compute for training to AlexNet-level performance on ImageNet has been decreasing exponentially — halving every 16 months, in total a 44x improvement. By contrast, Moore's Law would only have yielded an 11x cost improvement: https://openai.com/blog/ai-and-efficiency/",2020-05-05T00:00:00,[],https://scontent.fcai19-7.fna.fbcdn.net/v/t1.6435-9/95582019_1399137263608215_6705405446204686336_n.png?stp=dst-png_s960x960&_nc_cat=104&ccb=1-7&_nc_sid=730e14&_nc_ohc=sV6P8lfiYk8AX_ovgG8&_nc_ht=scontent.fcai19-7.fna&oh=00_AfApzrL9gmFx2dVlx0EBuZYJUkw0jS5Z12OysTkuvjKhHw&oe=64F08DA3,https://www.facebook.com/openai.research/posts/pfbid0GXCKewL7k9Qsmdp5i2ggLWgtXw5GW1ZSNSPBp6WYrLzsSh9RUJmcLPfLqFP5ELZHl?__cft__[0]=AZWep8B6KpZGlGt_0mqHbDgDGLNGaMPCfVRH9G7o3CyAw2T1IbGU11zbItYB2v9NkieiXrJgZbCnny-3XbWOzo2zzlWzX5Js0q9iQNqxRXnVGWHmzklPxF-ROq6Qk-qCOLKxJJ6MDmJTUtPxzpkD4vh5eq4CQYvfLXRwguuLvwUSdv2nN7EYDDQmFEC1AZNd7PW3s6Z57cGaVkViPJjz78GF&__tn__=%2CO%2CP-R,579,0,positive
pfbid0zE6DPpxLCpYDqwgtqdCxXfY9Hs8sKPBZi3UBQixi6BT4or9FtmeehXmXCV2RsfbYl,OpenAI,114,483,55,39,0,0,0,0,577,54,"Introducing Jukebox, a neural net that generates music, including rudimentary singing, as raw audio in a variety of genres and artist styles. We're releasing a tool for everyone to explore the generated samples, as well as the model and code: https://openai.com/blog/jukebox/",2020-04-30T00:00:00,['blob:https://www.facebook.com/4e2e5d88-8b08-41ef-8530-73cd147752d5'],https://scontent.fcai19-7.fna.fbcdn.net/v/t15.13418-10/94976179_802439936951914_8132937521811161088_n.jpg?stp=dst-jpg_p640x640&_nc_cat=102&ccb=1-7&_nc_sid=ad6a45&_nc_ohc=ArGNel84b6wAX9J7IV6&_nc_ht=scontent.fcai19-7.fna&oh=00_AfA8j3HGAgYB_JGNhWh8JeUCNK8kV9GdrD6CNGDc3x-v3w&oe=64CE7B09,https://www.facebook.com/openai.research/posts/pfbid0zE6DPpxLCpYDqwgtqdCxXfY9Hs8sKPBZi3UBQixi6BT4or9FtmeehXmXCV2RsfbYl?__cft__[0]=AZXY_Razauh9vYUXA94BQS_x8Am047Wtp9tIiknFaULxvu5cStguf3k864ZuUtuoRWcs8WBF_GGbf92rfAf_hyl5vjP_dJHLDfzpgS0Q5cxqW5d_MWWxBnoXSJ54n-aeamwM0xl5Z2CPAdjidTcMdcG9iAvI-GX6akcoPnuOrYuxSTvZbjPgqJjbZBrqji1Q4QvVDfXR5lHnSzw9qBQZICiNGl2elEwO3YkuZUfkJhL1Kw&__tn__=%2CO%2CP-R,691,0,positive
pfbid02Nci2KkWRSnoiTUjYjGrieN4wKi3JCuTXeKWEzanR4hP3UPNytPsDKgCpTyydkvTjl,OpenAI,116,635,60,0,0,0,0,0,695,50,We're standardizing OpenAI's deep learning framework on PyTorch to increase our research productivity at scale on GPUs (and have just released a PyTorch version of Spinning Up in Deep RL): https://twitter.com/OpenAI/status/1222927584033247232,2020-01-30T00:00:00,[],https://scontent.fcai19-7.fna.fbcdn.net/v/t1.6435-9/83896874_1320269424828333_6405901231872540672_n.png?stp=dst-png_s960x960&_nc_cat=108&ccb=1-7&_nc_sid=730e14&_nc_ohc=64kDD6x2rbMAX-OqPAd&_nc_ht=scontent.fcai19-7.fna&oh=00_AfDgDZwAG9zvAZ2ryYIZcGZ0-KQRiQVjbnGn-me95BEgJA&oe=64F0B5C9,https://www.facebook.com/openai.research/posts/pfbid02Nci2KkWRSnoiTUjYjGrieN4wKi3JCuTXeKWEzanR4hP3UPNytPsDKgCpTyydkvTjl?__cft__[0]=AZWO5TzRIELlhLAW1ebJ6FMLQ-AkXyZrDKhV21sphpQ1MkEai0epAeRxUCc0dBeQ1IRqVKc3FTjyO4K7lkeYyiI_7f2NY1xD4l8UaBOXneeTgj4SvK4_DVC9K7SL9CLaHwjS9D9gzh_ZvXwrgqCaiTB_zvSBOL3dYCeTfxACzBwXQbFD_MTO0Q5437HnW7X0lF9J-qLP9QuPINmqJtfuWnWc&__tn__=%2CO%2CP-R,811,0,positive
pfbid02SbaVaC1z25KsiUMpkmrY58ZTyVaZcHTnRTn3SP2Wb7RgUPi38S7KFGkEJNTjT1Ufl,OpenAI,44,416,42,0,0,0,0,0,458,30,"We're releasing ""Dota 2 with Large Scale Deep Reinforcement Learning"", a scientific paper analyzing our findings from our 3-year Dota project: https://openai.com/projects/five/One highlight — we trained a new agent, Rerun, which has a 98% win rate vs the version that beat @OGEsports.",2019-12-13T00:00:00,[],https://external.fcai19-7.fna.fbcdn.net/emg1/v/t13/10332535334742334873?url=https%3A%2F%2Fopenai.com%2Fcontent%2Fimages%2F2019%2F12%2FOPEN_AI_DOTA_FINALS_3_DSC1231.JPG&fb_obo=1&utld=openai.com&stp=c0.95.2000.1044a_dst-jpg_flffffff_q75_s500x261&ccb=13-1&oh=06_AbF6p-HICXOlVnPMEjxsWaGDYXzmYb17UkEBwKWK1MGZwQ&oe=64CB057A&_nc_sid=ff403b https://external.fcai19-7.fna.fbcdn.net/emg1/v/t13/11374216730095658970?url=https%3A%2F%2Fwww.ox.ac.uk%2Fsites%2Ffiles%2Foxford%2Ffield%2Ffield_image_highlight%2Fannie-spratt-sggw4-qDD54-unsplash.jpg&fb_obo=1&utld=ac.uk&stp=c0.5000x0.5000f_dst-emg0_p98x98_q75&ccb=13-1&oh=06_AbGARO_mJ_4ADkEIDdEsPZay_HjqrgnssNQJFTn4DK6lyA&oe=64CAF4C7&_nc_sid=dbad39,https://www.facebook.com/openai.research/posts/pfbid02SbaVaC1z25KsiUMpkmrY58ZTyVaZcHTnRTn3SP2Wb7RgUPi38S7KFGkEJNTjT1Ufl?__cft__[0]=AZUYt_MRjDECon84e-Jx_j-KXewp_iem9a50VcVamLRsTVLFVmPZW3N-5A1XpLdsCpnxn4SOwhB6ygrzlPRbvr9vN06wCOsWMuWkVvmh1icwADnSgOQrQaj-llCO3QRHo3yAq1e6WA1oauC-Clc0nIBmzAeDOnJipBr5E-os_C0oWGi4IwmIWsWz-DFon3L712rGTKvdL5e8HUujf8Wws-AG&__tn__=%2CO%2CP-R,502,0,positive
pfbid0hbsgcUQ9dMQebDqr5jMyLg8ijdy8vfi6knqsDbtBHPed4hfxwX2pUBzTHArc2H3Wl,OpenAI,43,303,0,24,0,0,0,0,327,16,"A surprising deep learning mystery:Contrary to conventional wisdom, performance of unregularized CNNs, ResNets, and transformers is non-monotonic: improves, then gets worse, then improves again with increasing model size, data size, or training time.https://openai.com/blog/deep-double-descent/",2019-12-05T00:00:00,[],https://scontent.fcai19-7.fna.fbcdn.net/v/t1.6435-9/79932933_1270728539782422_5130827674796687360_n.png?stp=dst-png_s1080x2048&_nc_cat=105&ccb=1-7&_nc_sid=730e14&_nc_ohc=xpZHdEfEJoEAX9hIxSR&_nc_ht=scontent.fcai19-7.fna&oh=00_AfCxT0Y3istq4qdtgG7Ffrpe9XsKK8t8wWz1tWijfH-CIA&oe=64F0BFA0,https://www.facebook.com/openai.research/posts/pfbid0hbsgcUQ9dMQebDqr5jMyLg8ijdy8vfi6knqsDbtBHPed4hfxwX2pUBzTHArc2H3Wl?__cft__[0]=AZWohJcYh1ms6tOLX954firYAwWBksAzgxiO2KL6fR-iurpFaqMGK79O8K_cv_KbOzFACV9WJk6M09VpXhU1cDz0TjRiUYkEd7wgG9NVWQuBpu1e_Hhp0u6HcMxt2zpndcruBRGS5EuabzIbQlgy3H8Q_wMXvhdoLhSoRbi0VZ2LSkMizpFevbNbuGDu0sopmnCRdmubWTvCHmp48Ah1sy1P&__tn__=%2CO%2CP-R,370,0,positive
pfbid02LpJYMzysvaKK7KcaL5mydXaHc2gW584oY6wRyQFMMXHkYL9LbybzaBKCu8KZcp92l,OpenAI,40,215,19,0,0,0,0,0,234,9,"We're releasing Procgen Benchmark, 16 procedurally-generated environments for measuring how quickly a reinforcement learning agent learns generalizable skills.This has become the standard research platform used by the OpenAI RL team: https://openai.com/blog/procgen-benchmark/",2019-12-03T00:00:00,[],https://external.fcai19-7.fna.fbcdn.net/emg1/v/t13/143141077403433689?url=https%3A%2F%2Fopenai.com%2Fcontent%2Fimages%2F2019%2F12%2Fog-image.jpg&fb_obo=1&utld=openai.com&stp=c0.5000x0.5000f_dst-jpg_flffffff_p500x261_q75&ccb=13-1&oh=06_AbGlSm6GXValX170a_STnd5A_Fg_fFouTnU16wspsUlVjw&oe=64CAE5D4&_nc_sid=dbad39 https://static.xx.fbcdn.net/rsrc.php/v3/yw/r/8iuTX4LlGZO.png,https://www.facebook.com/openai.research/posts/pfbid02LpJYMzysvaKK7KcaL5mydXaHc2gW584oY6wRyQFMMXHkYL9LbybzaBKCu8KZcp92l?__cft__[0]=AZUX-V6vGh3Q4rFSwDMFtX4owTJpbVMOXF15UzI8APePD3c87waSizy1eo99UKQm5QaD7UKdu2AVxoxQ6hxPIFWcmfTEWWeIXRjmZEm8tOGqgBfoHePeNSHKiWrpzBZj0Si8U0C_nwqQ4_bgjLzdCt0XoQhYfsPMAQKr7bQUK6dPee6aUCupIBWYG3442PR46l05cMrJWwClktLUhyBPghqE&__tn__=%2CO%2CP-R,274,0,positive
pfbid0bwNT8rA56RND34ReK4Q2gYoG86p5zynXAgFMknhmeQvor2Fg5PoU9uisLc2NvXrrl,OpenAI,36,191,24,0,0,0,0,0,215,8,"We're releasing Safety Gym, environments and tools to evaluate reinforcement learning with safety constraints: https://openai.com/blog/safety-gym/Aims to ultimately help agents satisfy real-world safety requirements while training (eg not driving off a cliff, not writing abusive content).",2019-11-21T00:00:00,[],https://external.fcai19-7.fna.fbcdn.net/emg1/v/t13/11810377064647312513?url=https%3A%2F%2Fopenai.com%2Fcontent%2Fimages%2F2019%2F11%2Fsafety-gym-cover-2.png&fb_obo=1&utld=openai.com&stp=c0.5000x0.5000f_dst-jpg_flffffff_p500x261_q75&ccb=13-1&oh=06_AbGfuZIE5pZM3FsoYjZsMm8DFWHughbZ2iZQ7o6JqI9ajQ&oe=64CAA037&_nc_sid=dbad39,https://www.facebook.com/openai.research/posts/pfbid0bwNT8rA56RND34ReK4Q2gYoG86p5zynXAgFMknhmeQvor2Fg5PoU9uisLc2NvXrrl?__cft__[0]=AZUY31j56-d5evFZ0ZdFsi7BL3kWbP45mXuDhm808vVKHN8wvmQ-K_NBEf7PHOhH5pHTcgU5FLZ6nX-OBF6jWHK3NhTS-NxG_6K8f14QBqMaN5KO9LJI_j8o7Bv1Ax6EMsOWgI77EiJIDn_MJRr4zOvUcyCZ3hx2r7-A2zO4U58TIX0061fAzzK4Wn0c4wRbnLqnK-hmHNkcLEnezvzt8oXX&__tn__=%2CO%2CP-R,251,0,positive
pfbid0Le9XENh122dqnknsDrVLd1cLQZURcgp4ob2PtEAcRBCoxtUt9RWKk1JX4etTNcRKl,OpenAI,57,252,29,22,0,0,0,0,303,43,We're releasing the 1.5billion parameter GPT-2 model as part of our staged release publication strategy.- GPT-2 output detection model: https://github.com/.../gpt-2-output.../tree/master/detector- Research from partners on potential malicious uses: https://d4mucfpksywv.cloudfront.net/papers/GPT_2_Report.pdf- More details: https://openai.com/blog/gpt-2-1-5b-release/,2019-11-05T00:00:00,[],https://scontent.fcai19-7.fna.fbcdn.net/v/t1.6435-9/75543459_1244743475714262_1371225926234275840_n.jpg?_nc_cat=111&ccb=1-7&_nc_sid=730e14&_nc_ohc=nBK3Bi_4l9QAX88GM_l&_nc_ht=scontent.fcai19-7.fna&oh=00_AfD1XTIun10Se-BEtB-_Exq_T2wPAlfx5q-M34ayZZKngQ&oe=64F09C2E,https://www.facebook.com/openai.research/posts/pfbid0Le9XENh122dqnknsDrVLd1cLQZURcgp4ob2PtEAcRBCoxtUt9RWKk1JX4etTNcRKl?__cft__[0]=AZVBOkRhLMXDX7KlaS5CGew2kPcU_sSN-94s7-kfgM0hY2AIVPO6LKpguvUIUjT7Nqq9NUdP-UNKt16qqwuVNThaAm7dvjCiJzyYVlq1g-Zb3XHoGeooJjC9uk_mt2hMDMllu3k9AhIaVoX6g3yzXcyqC7epE0v6fL3iGrDiexmAWxArYDqQUHCtzLrlC5Rngt5qFJCF8UJ7-eumnJ7UPFDk&__tn__=%2CO%2CP-R,360,0,positive
pfbid0vb6ZpGokbTMYK6Pr2cMNhpepzLgqiRQfSjkrtRx4rRCS7zyZCJsFXDP1SNP58ZMml,OpenAI,31,407,56,0,0,0,0,0,463,36,"""Solving the Rubik's Cube with a Robot Hand"" took many human hands over the past 2.5 years — meet our Robotics team! (PS they're hiring: https://openai.com/jobs/!)",2019-10-16T00:00:00,[],https://scontent.fcai19-7.fna.fbcdn.net/v/t1.6435-9/72568141_1227404510781492_891891542887759872_n.jpg?stp=dst-jpg_p180x540&_nc_cat=110&ccb=1-7&_nc_sid=730e14&_nc_ohc=TouZQIEDPFIAX8syxvM&_nc_ht=scontent.fcai19-7.fna&oh=00_AfAZLOYxjk8SryX9OT3LlM1gS3pGtJz7SozhknJPAqRsFQ&oe=64F0A557,https://www.facebook.com/openai.research/posts/pfbid0vb6ZpGokbTMYK6Pr2cMNhpepzLgqiRQfSjkrtRx4rRCS7zyZCJsFXDP1SNP58ZMml?__cft__[0]=AZUhOkE32NBwrJAx65JvYSq8UeoslsdJZZgC81xnLYSNGlqLfFi_57MwLLfl3pTc64EO1ksDpJbpw1DAYznFGDoAqznMsCzKlAEnePVvd7zB0D0UrdTFcIOmzPti2qDtqdT6otTdDTp8DpfQkv866kDIZamid-cyXZADBq6P-p-vtsENyzPVHXxJIe19obcDjRJZDUdArlODeR1iLU962GFt&__tn__=%2CO%2CP-R,494,0,positive
pfbid0249aKmz4szqbnVCBy6G5jJw1tSF7r3oneKoq3qAQLpm19YDo3aXfQGSSrbAu8A8u5l,OpenAI,62,236,18,0,0,0,0,29,283,20,"We’re all used to robots that fail when their environment changes unpredictably. Our robotic system is adaptable enough to handle unexpected situations not seen during training, such as being prodded by a stuffed giraffe:",2019-10-15T00:00:00,['blob:https://www.facebook.com/c268b154-b7a0-4c80-ba2f-bb43a81c4ace'],https://scontent.fcai19-7.fna.fbcdn.net/v/t15.13418-10/70874576_588448761953904_6591947588658790400_n.jpg?stp=dst-jpg_p180x540&_nc_cat=109&ccb=1-7&_nc_sid=ad6a45&_nc_ohc=crQIseudmPAAX_NZW-M&_nc_ht=scontent.fcai19-7.fna&oh=00_AfDaaj21zZNHBW7e_ocGq9T3o7XrFQDoZQShvEcDzk277A&oe=64CEC302,https://www.facebook.com/openai.research/posts/pfbid0249aKmz4szqbnVCBy6G5jJw1tSF7r3oneKoq3qAQLpm19YDo3aXfQGSSrbAu8A8u5l?__cft__[0]=AZUIo22cRyXmdj_bEgo5_yavtBlHzPedoCdsVag45tilfHR8J-R78S-WcIooCdZ6z0v5SGctBDXWjGwPHQ-1aqOk4byEVQMvMhB-61ApxhEqg0oPhv9Kik2w6P369-f2y6R426YT1B1XZf7ZCL5OCNcEUqP4fJMDAG510yt-79qIeJ1yphQcux-uf9TYc_eUTbuBbBs5UW78x9XVxgqeWC0N7O-M4txUeNOzoPNJWjW7iA&__tn__=%2CO%2CP-R,345,0,positive
pfbid02CU4nSc8HNfBCRRfq9b4xvpbwHBfxCotzHrxjELCzreS8HD8TJm2YjffMyFBMrWeol,OpenAI,313,472,69,88,0,0,0,0,629,33,"We've trained an AI system to solve the Rubik's Cube with a human-like robot hand.This is an unprecedented level of dexterity for a robot, and is hard even for humans to do.The system trains in an imperfect simulation and quickly adapts to reality: https://openai.com/blog/solving-rubiks-cube/",2019-10-15T00:00:00,['blob:https://www.facebook.com/3ffee3de-b66d-4b8d-a4d6-69f5fa36fc47'],https://scontent.fcai19-7.fna.fbcdn.net/v/t15.5256-10/69893344_2528029124150391_2791287258416676864_n.jpg?stp=dst-jpg_p180x540&_nc_cat=111&ccb=1-7&_nc_sid=ad6a45&_nc_ohc=5a837OnV-dAAX_AQ4OZ&_nc_ht=scontent.fcai19-7.fna&oh=00_AfAvqF1C1g-01ZuzeMfjlLrdhzuZReveiPuz-ISxHXsDdg&oe=64CE131F,https://www.facebook.com/openai.research/posts/pfbid02CU4nSc8HNfBCRRfq9b4xvpbwHBfxCotzHrxjELCzreS8HD8TJm2YjffMyFBMrWeol?__cft__[0]=AZWmVDldBHR8pzkzki1gqXb4CkXsljl7dftoYF0SKm1cMP-ySyasqvhFAGloMVZ5mYxyA0lSDGgy5qQs7xYzM6mh9Vf4A0yAqk3p639nhgh6DzwGhkwzTUQSqpyB9NLdeih6caE5ibjXuUyBLBUOyamzxlXTxFs6YefscG5e0FKVNhLfS9KjjsMDIFkouxxQKj4noGZ7tV0zNJ4MHv-enzEafrp_IQvvL3Ge9aG7Fthm1Q&__tn__=%2CO%2CP-R,942,0,positive
pfbid0MDnT8o9axWy1vpqbqX7fNTkkZRJsJhpHYgy3fD93m1dNmh1MwTfUNhG33MFrM3Lql,OpenAI,31,107,12,0,0,0,0,0,119,11,Now accepting applications for our 3rd class of OpenAI Scholars: a 4 month full-time program for individuals from underrepresented groups to study deep learning and produce an open-source project: https://openai.com/blog/openai-scholars-spring-2020/,2019-10-11T00:00:00,[],https://external.fcai19-7.fna.fbcdn.net/emg1/v/t13/9011803195624031144?url=https%3A%2F%2Fopenai.com%2Fcontent%2Fimages%2F2019%2F10%2FIMG_7650-2.jpg&fb_obo=1&utld=openai.com&stp=c0.95.2000.1044a_dst-jpg_flffffff_q75_s500x261&ccb=13-1&oh=06_AbFD3vSisZPwta1xFtjEifGDxMJt-rMKcV68x-aBqJuVhg&oe=64CB1478&_nc_sid=ff403b,https://www.facebook.com/openai.research/posts/pfbid0MDnT8o9axWy1vpqbqX7fNTkkZRJsJhpHYgy3fD93m1dNmh1MwTfUNhG33MFrM3Lql?__cft__[0]=AZUnr1f6YXWhrozHHeMT5EaCspnqzi-nrc8d92xQQz3px_hDP-kUWoWAShM9y9oCkIeY973EKRYgKgx_NDU_PE5ox7McWDWmvgb_aNVjxV3Btc0c8GxQ2n2ZUsEzidZ5a91QHZ-iYAd8x4zkpG3KcYd56AtiqH8T3HJC6Ff-9_ofOLODHGiU5OemvnvbzQOAAhJumLlr1qRcRDVx8Tj5j9YV&__tn__=%2CO%2CP-R,150,0,positive
pfbid02o4amGzEQU56eYehuERQ4YQTkg6z5Sa2sC3GeXQXDXy5C7GxqsDmsmdBknybFixmal,OpenAI,15,85,0,0,0,0,0,0,85,2,"We've fine-tuned GPT-2 using human feedback for tasks such as summarizing articles, matching the preferences of human labelers (if not always our own). We're hoping this brings safety methods closer to machines learning values by talking with humans. https://openai.com/blog/fine-tuning-gpt-2/",2019-09-19T00:00:00,[],https://external.fcai19-7.fna.fbcdn.net/emg1/v/t13/8084641966648390132?url=https%3A%2F%2Fopenai.com%2Fcontent%2Fimages%2F2019%2F09%2Ffine-tuning-gpt-2.png&fb_obo=1&utld=openai.com&stp=c0.5000x0.5000f_dst-jpg_flffffff_p500x261_q75&ccb=13-1&oh=06_AbFpha_Q3B1De7ebXDS6AfefOLntfXUbUWp274gacyPwUw&oe=64CAAF12&_nc_sid=dbad39,https://www.facebook.com/openai.research/posts/pfbid02o4amGzEQU56eYehuERQ4YQTkg6z5Sa2sC3GeXQXDXy5C7GxqsDmsmdBknybFixmal?__cft__[0]=AZUG-vUVd2ZKf0cElT2wKiJPZ5wOcedEjvrxHIXPOwSPNhUFwd8Xupd7h-hVNhSwDkkOQGCj2zX9_g5PGO3GnCSWHjAcILaShWHNA2iZk9gCnsjm-z9A5P8LoMGlyb2Zz9E7CpvWHlYxB67m-_PK6zyZcLxbUSX6TZ-GUQCmRTHGcA0Z7_4G_jLDZcftQl6cyeSOrhUpzNMh8XKLtRqSFJ9g&__tn__=%2CO%2CP-R,100,0,positive
pfbid0DcMfqcWYVDkhYDY6eBo4N288BgGk1vbKiqkhjmGZNqdiUh5jfjgmrASnETUKuGeHl,OpenAI,109,181,24,20,0,0,0,0,225,20,"We've observed AIs discovering complex tool use while competing in a simple game of hide-and-seek. They develop a series of six distinct strategies and counterstrategies, ultimately using tools in the environment to break our simulated physics: https://openai.com/blog/emergent-tool-use/",2019-09-17T00:00:00,[],https://scontent.xx.fbcdn.net/fb.png https://external.fcai19-7.fna.fbcdn.net/emg1/v/t13/3337143555001472154?url=https%3A%2F%2Fmedia1.tenor.co%2Fimages%2Ff252207778e6eeead072e9557b451862%2Ftenor.gif%3Fitemid%3D4570342&fb_obo=1&utld=tenor.co&stp=dst-emg0_q75_s362x200&ccb=13-1&oh=06_AbGCdt_IkTgs4se0dXih8PfMjyMfRMVASbP9icGcQlPHvQ&oe=64CAFFA8&_nc_sid=dbad39,https://www.facebook.com/openai.research/posts/pfbid0DcMfqcWYVDkhYDY6eBo4N288BgGk1vbKiqkhjmGZNqdiUh5jfjgmrASnETUKuGeHl?__cft__[0]=AZVhsxtcr4n02n38GYIKH3oyqelCDoCZea31N2BSLCNYwFKu3JxKHhuPQ7Ttobd2OshRv7WY1XGDVoz-cuorE9hd5w2Si_3rgHlYw0NrxFhqHttIMqmkcx1JFvYR7bnENTXwRUldH1sIrQ7I8xrslQ4ER_TtvRtgEaUOiDWj8CA_P9n3UUWiGIy1RRmkqR747RTK10qFOxcgw3yN2MluDApc&__tn__=%2CO%2CP-R,334,0,positive
pfbid02nc3ZFjqAsg1EJEXkvZrRqdU3omx4q2dND6HvJDo3YXph8VTzsAxMxCmfUkuHmCGVl,OpenAI,8,56,8,0,0,0,0,0,64,7,"We're releasing a new method to test for model robustness against adversaries not seen during training, and open-sourcing a new metric, UAR (Unforeseen Attack Robustness), which measures how robust a model is to an unanticipated attack: https://openai.com/blog/testing-robustness/",2019-08-22T00:00:00,[],https://external.fcai19-7.fna.fbcdn.net/emg1/v/t13/14298140227007166338?url=https%3A%2F%2Fopenai.com%2Fcontent%2Fimages%2F2019%2F08%2Fespresso-2.gif&fb_obo=1&utld=openai.com&stp=c0.5000x0.5000f_dst-jpg_flffffff_p139x139_q75&ccb=13-1&oh=06_AbHbCj2YmUc_rLRu0IifoZXIq1fJPPw29P8sFea_peXGXQ&oe=64CB261B&_nc_sid=dbad39,https://www.facebook.com/openai.research/posts/pfbid02nc3ZFjqAsg1EJEXkvZrRqdU3omx4q2dND6HvJDo3YXph8VTzsAxMxCmfUkuHmCGVl?__cft__[0]=AZUtXxMcoSChLdiH4Rq4O-asCQI61nnnqF2mkB2m6HCnNNYoVVTuONmG_d8J2p5YHIpSD-msTmH3C8C7Rghu0MkZZ0iwPMAO6VlbQQvuulSYkK8MwQNObPMuqfUm6j9nWjOrT1Klm06vJolDKqFCsLirGmIS-6f1EaqM09HOJcnv7gHs0IaUII4C3Ji_tpg5d4CMZXBfDGMEZIvWh78eT7ab&__tn__=%2CO%2CP-R,72,0,positive
pfbid0VWrYPYkpRXUfttJqh3ExC8BESpGQLg33SdVo52sNyZMhHp2zexTCjvQfRxFMLJynl,OpenAI,18,92,0,7,0,0,0,0,99,5,"GPT-2 6-month follow-up: we're releasing the 774M parameter model, an open-source legal doc organizations can use to form model-sharing partnerships, and a technical report about our experience coordinating to form new publication norms: https://openai.com/blog/gpt-2-6-month-follow-up/",2019-08-20T00:00:00,[],https://external.fcai19-7.fna.fbcdn.net/emg1/v/t13/12967374653218535997?url=https%3A%2F%2Fopenai.com%2Fcontent%2Fimages%2F2019%2F08%2Fgpt-2_update_8-15a-1.jpg&fb_obo=1&utld=openai.com&stp=c0.5000x0.5000f_dst-jpg_flffffff_p500x261_q75&ccb=13-1&oh=06_AbEHRhotMe5pn-NLqGxpZTZcHUOCknOG8E0rOOtRoBVhdw&oe=64CAA367&_nc_sid=dbad39,https://www.facebook.com/openai.research/posts/pfbid0VWrYPYkpRXUfttJqh3ExC8BESpGQLg33SdVo52sNyZMhHp2zexTCjvQfRxFMLJynl?__cft__[0]=AZXqzdRnCYrsKMAg3hoAqEy_EeWGLxanjRcKRNlpD83Ro7jcCxMQqscb9-TkucpjsapgMj_JWdgmSAiN09IEkwmXlOJuDiY81kXr81OoRbQTt872CiB_ij4vNPIFa82ZuXHhw6RnLW_8SMLfA2XVkuVBnswbsfq49dFCcO1QdPAFl4-v9GeftL5PQWFO61nLSOpcOzGzP2HcE54RceNMDe9T&__tn__=%2CO%2CP-R,117,0,positive
pfbid02UeBRJHfEEFUKb2ZfwJaLCFAwdcXc418TSDeFKgnTYFRYivxZa2cP7uNnjoQE2vMkl,OpenAI,9,143,14,0,0,0,0,0,157,4,Each Thursday at OpenAI is Learning Day: a day where employees have the option to self-study technical skills that will make them better at their job but which aren't being learned from daily work.Here's how it works: https://openai.com/blog/learning-day/,2019-08-01T00:00:00,[],https://external.fcai19-7.fna.fbcdn.net/emg1/v/t13/10231629015635778685?url=https%3A%2F%2Fopenai.com%2Fcontent%2Fimages%2F2019%2F08%2Flearning-day_small-1.jpg&fb_obo=1&utld=openai.com&stp=c0.5000x0.5000f_dst-jpg_flffffff_p500x261_q75&ccb=13-1&oh=06_AbGkrAxhE95Ckh9mnK1QZbskO6ax3IazM7UM5ywg14YQzQ&oe=64CAE21C&_nc_sid=dbad39,https://www.facebook.com/openai.research/posts/pfbid02UeBRJHfEEFUKb2ZfwJaLCFAwdcXc418TSDeFKgnTYFRYivxZa2cP7uNnjoQE2vMkl?__cft__[0]=AZXwzt-YANOpHeVF1rorGyHCj23Q3ak0DqIZ7n1BnKjPfRca72TsBjqJSqACC6ey-vo7_ukKb_qflZpaVgR5o112qTscX7CgRd7pJpZTnoTGwDY0ZiXA15apSnhO-aAOfK-2WsjKrAhHRb7WXrRjp7VE0ujF0OTtjh6rTAcKKNQkhX0BQUUW7oOdr0ZJCeI7Dya3LXJA7dwWn-b2F2dr-CyI&__tn__=%2CO%2CP-R,166,0,positive
pfbid0jxH5jc4fAMBjyTvexdgsC6GVTtcyx6rqFnqzJfTVdsnPcGUoruBLZkJ7H7YoetHXl,OpenAI,39,161,10,0,0,0,0,0,171,4,"A conversation with Sam Altman and Satya Nadella about the promise of AGI, the need for massive compute power to make it real, and OpenAI/Microsoft's joint commitment to AI safety: https://www.linkedin.com/.../urn:li:activity.../",2019-07-22T00:00:00,[],https://external.fcai19-7.fna.fbcdn.net/emg1/v/t13/9569501322522741459?url=https%3A%2F%2Fdms.licdn.com%2Fvideo-thumbs%2FC5605AQE9_sIGKsrFdA%2Fb6d0083ee991464d9c17e7dc6be78a4b%2Ffeedshare-videocover_high-captions-thumbnails%2F1280x720-00001.jpg&fb_obo=1&utld=licdn.com&stp=c0.17.1280.668a_dst-jpg_flffffff_q75_s500x261&ccb=13-1&oh=06_AbEdsUlBS65ecVcl6nzWwBwjgOXN_MF4vgqDIj5nZqbWUg&oe=64CAF632&_nc_sid=ff403b,https://www.facebook.com/openai.research/posts/pfbid0jxH5jc4fAMBjyTvexdgsC6GVTtcyx6rqFnqzJfTVdsnPcGUoruBLZkJ7H7YoetHXl?__cft__[0]=AZXNw-MzIlkjiIQy13AkWi4jesh08g5Hf_b_9tjYnLLyc0u4WPGnx8f1hd9VeWyaDIbVZ1bRX-FOmIsxnMD0CUp9OeT5oetFCbWcN38N2xWNu5V6PcqwmK4yW-aMbQwIaK8tiUWxCMUTDF3CDxcp27rcPD8x6bJbJ7H7zIyCxfgI6qUp2-6FTuAuans62ikx2Wo2luuy6uX1yiRMIwSlit0-&__tn__=%2CO%2CP-R,210,0,positive
pfbid0pmCbRDf4Di55qwh2dmYHhyKEpZ2h1gMsvxnqUhe6aT3J7LVD7rWA8UGiwc4DfF7Vl,OpenAI,119,404,49,60,0,0,0,0,513,27,Microsoft is investing $1 billion in and partnering with OpenAI to support us building beneficial AGI: https://openai.com/blog/microsoft/,2019-07-22T00:00:00,[],https://external.fcai19-7.fna.fbcdn.net/emg1/v/t13/10974070184528544238?url=https%3A%2F%2Fopenai.com%2Fcontent%2Fimages%2F2019%2F07%2Fopenai-msft-twitter_7-21b-1.jpg&fb_obo=1&utld=openai.com&stp=c0.5000x0.5000f_dst-jpg_flffffff_p500x261_q75&ccb=13-1&oh=06_AbFmPdW9lD1UZbGJ0n3MzxVWOe85_U7h7bkR4ogwzsGAgA&oe=64CAD7DE&_nc_sid=dbad39,https://www.facebook.com/openai.research/posts/pfbid0pmCbRDf4Di55qwh2dmYHhyKEpZ2h1gMsvxnqUhe6aT3J7LVD7rWA8UGiwc4DfF7Vl?__cft__[0]=AZXeIkGA6BfLfRevo4lzu-I03u1R-6euWTS-Q9-LxO8h6yUiNxjpIUzXeNDVNSQ9D-cXjBS-7UH9MpILm-n_HPaoFgqwb-5IswrVhAqFRvQS3Yy6LwErxDHwqbp7OtVxJBSQwDeC8J6BBhhu4lCkbFJGq0CI8CWEQ_AfHDmuEECTJcvM59weAX0QpXdV13EzvaMpkL-Dl6k06dx3qKahbx7t&__tn__=%2CO%2CP-R,632,0,positive
pfbid037YooenDhCZ97SMNa56eU5PJuEioAqFD8f9C4ine9ubDkczbyDENiA3bhzyarUM4ml,OpenAI,31,110,9,7,0,0,0,0,126,17,MuseNet is playing an experimental concert from now until 3pm PT on livestream: http://twitch.tv/openai No human curation or filtering involved — these are samples generated directly by MuseNet without any human intervention. Please enjoy!,2019-04-25T00:00:00,[],https://scontent.fcai19-7.fna.fbcdn.net/v/t1.6435-9/58570496_1027575917431020_839234633953443840_n.jpg?stp=dst-jpg_p180x540&_nc_cat=107&ccb=1-7&_nc_sid=730e14&_nc_ohc=YgHVFNMz4O8AX_BgPGy&_nc_ht=scontent.fcai19-7.fna&oh=00_AfAp8cxwRjttt7I0h5aFIw-UJaNFYh_zaWYxRm6jmQW2xw&oe=64F0B60D,https://www.facebook.com/openai.research/posts/pfbid037YooenDhCZ97SMNa56eU5PJuEioAqFD8f9C4ine9ubDkczbyDENiA3bhzyarUM4ml?__cft__[0]=AZUJkYjEmpwxP4vk7HycGYIDLoqCPXA4Dq5RTRpYTxhNDSW7OPgEmrsTxYJJVTHlTzY39Y57sAMYxhdDnYhqLa1apKzB-gA3r2NefwlAEH1_9LSZ4Bwacx60emS4GQApvXldC6PvDX_MM8_elbX-Ak_OPxfuIhZEiD6uiIYu4QU4topa14d1kkgw4XYLh-IdXoOjMXs6Y95gpBnXZf2WnT-n&__tn__=%2CO%2CP-R,157,0,positive
pfbid02bKmSsZDP1haAY6qsdznNhszaSDTcKMN53Rrg9MttxWrG6SC3ELFDUrUuD9EMUHgEl,OpenAI,47,146,14,9,0,0,0,0,169,26,"We've created MuseNet, a neural network which discovered how to generate music using many different instruments and styles.Listen to MuseNet samples, and interact with a prototype co-composer tool, here: https://openai.com/blog/musenet/ MuseNet will play an experimental concert today from 12–3pmPT on livestream: http://twitch.tv/openai",2019-04-25T00:00:00,['blob:https://www.facebook.com/177cdad4-7c2a-4c81-9a20-f40935acd5ec'],https://scontent.fcai19-7.fna.fbcdn.net/v/t15.13418-10/56990496_285271705728631_7403366962136350720_n.jpg?stp=dst-jpg_s960x960&_nc_cat=105&ccb=1-7&_nc_sid=ad6a45&_nc_ohc=BFEVx3vvh9MAX_Ujo8b&_nc_ht=scontent.fcai19-7.fna&oh=00_AfAcYgXUJgT5n3pFbKQDVP6rngQLMkYjBI5FligRLdJrEw&oe=64CE4B21,https://www.facebook.com/openai.research/posts/pfbid02bKmSsZDP1haAY6qsdznNhszaSDTcKMN53Rrg9MttxWrG6SC3ELFDUrUuD9EMUHgEl?__cft__[0]=AZWy0Iw6SWFiqopZ03Tr65yIfnzbfPXMC_4NlurN8qm7mGah0SbknCp_WQiZxBuaef-UMw029nGtVTUMEMBAmFmgMeA_W9xDOAy4dEsScmXkdEreeO5eJ2TGyGg9zJt7ilJuqyGAtThxzckoug5D6ZNOeZE542owyItAN8UQPU06YDz823W99LGUv9GBNzTZt-1hdEp73qjKW1TklrR6WVBCXmUx7AtPJi2TB4zXdCf4mg&__tn__=%2CO%2CP-R,216,0,positive
