id,name,shares,likes,loves,wow,cares,sad,angry,haha,reactions_count,comments,Summary,posted_on,Video_URL,Image_URL,URL,Positive_Reactions,Negative_Reactions,Sentiment Analysis,Rating
pfbid035itAU8ZRK6q2gV4gthWvbqoxFxypX5MAPymb1ZGEGvpbwRnRRBpXPahE5ZcFJg2el,Meta AI,33,108,16,0,0,0,0,0,124,6,"Join us for the MyoChallenge! Develop controllers for a physiologically realistic musculoskeletal hand to solve two of the most complex dexterous manipulation tasks: die reorientation simultaneous rotation of two Baoding ballsMyoChallenge is hosted on MyoSuite, an embodied AI platform by Meta that unifies neural and motor intelligence.Enter now through October 28 - both winners will be announced at #NeurIPS2022.For more details and to submit your solution: https://bit.ly/3PsoEWC",2022-08-15T00:00:00,['blob:https://www.facebook.com/e2a2dbdb-ea68-49af-ab65-91bfcbba4fb0'],,https://www.facebook.com/MetaAI/posts/pfbid035itAU8ZRK6q2gV4gthWvbqoxFxypX5MAPymb1ZGEGvpbwRnRRBpXPahE5ZcFJg2el?__cft__[0]=AZXLC8eV9ZW_rdg6tiUnBWRq2tAdYhPPNDsJMaNzopvwRDRBunESZYsY9x2Lgx1KqqV8qZssLcZfIpr_gytFOnbyzYHwax7kRwh4SNQZWhqbbY3mzmMiJ4OKwJkRAB11StInBiIO0uOk96jHiWGCY40PqlB2Xsd2STiNNToQd4O2Vkb6ycMk8nQC4N4fLhdrPR0YdoG5UlsbjzjcnKXUvSYDUY6SAK0UQS3DSkqX1hbM9w&__tn__=%2CO%2CP-R,157,0,positive,157
pfbid02viy63agUdiTqvFrAn4E6WRVjPs9Cpf4PZLuAmKBn9p5QreAmyL4B9NwrofsbrdSDl,Meta AI,15,101,14,0,0,0,0,0,115,4,"We’re excited to announce the Habitat Rearrangement Challenge at #NeurIPS2022! The competition evaluates how embodied agents can rearrange objects in physics-enabled, 3D settings. Object rearrangement focuses on mobile manipulation, low-level control, and task planning.Here is the challenge’s timeline:August 22: Test phase opensOctober 20: Challenge endsResults announced at #NeurIPS2022Check out the challenge website to get started: http://aihabitat.org/challenge/rearrange_2022/",2022-08-13T00:00:00,['blob:https://www.facebook.com/1664a90d-c3bb-433b-8dae-54ca0b09cd8d'],https://scontent.fcai19-7.fna.fbcdn.net/v/t15.5256-10/296463003_825564198821667_5565980885424134686_n.jpg?stp=dst-jpg_p180x540&_nc_cat=109&ccb=1-7&_nc_sid=ad6a45&_nc_ohc=vPf0Ma3CEAAAX9_sVFI&_nc_ht=scontent.fcai19-7.fna&oh=00_AfAOmzlg5VsHt6S_Imzc73yKg-lWfj5ftg5LfZm0oU-Ujg&oe=64E34E5B,https://www.facebook.com/MetaAI/posts/pfbid02viy63agUdiTqvFrAn4E6WRVjPs9Cpf4PZLuAmKBn9p5QreAmyL4B9NwrofsbrdSDl?__cft__[0]=AZXwgIN3GcSpEPUt3LRcfwkBRpa310IEHojvegqs2rTEHaumZYl5BxRTkFNMkSc4NA1u2qo-8RwsdYnRnDbtE1Cfho_12gm5LHW5EyKwPT6AYRPGVexBDRRWxiLGW6mlodmkrafjNctUIBTxfheosDsjXNAqyvwKHFQxQpN2MbsQqLkeeXNzoaWP3yRokklJTLfjC1s0fPTbk1QmA33toOE2_rpfDS77dXYKoXnzWrlcFg&__tn__=%2CO%2CP-R,130,0,positive,130
pfbid0G4SzSTVYmJraYNc8E6kywBap5MqbzUYt384xpRzieUSmCChkupZJJpuAjxCA4kwXl,Meta AI,27,162,18,0,0,0,0,0,180,10,"3D computer vision research just got easier!We’re releasing Implicitron, an extension of PyTorch3D that enables fast prototyping of 3D reconstruction and new-view synthesis methods based on rendering of implicit representations. Implicitron can take image data and create accurate 3D reconstructions to speed AR and VR research, making it faster and easier to create real-world applications like virtual shopping.Read more about Implicitron: https://bit.ly/3w0u9Fg",2022-08-12T00:00:00,['blob:https://www.facebook.com/aa9ad66d-04ea-48cf-8542-50c0baab3984'],https://scontent.fcai19-7.fna.fbcdn.net/v/t15.5256-10/297686219_5976660425696291_2563058352437105604_n.jpg?stp=dst-jpg_p480x480&_nc_cat=104&ccb=1-7&_nc_sid=ad6a45&_nc_ohc=aOVf_4qL_i8AX-CBwLJ&_nc_ht=scontent.fcai19-7.fna&oh=00_AfDkFU2ZrRITcnGPSUApC6dK4dtPOOm6GwemyLGb2ve5sA&oe=64E33156,https://www.facebook.com/MetaAI/posts/pfbid0G4SzSTVYmJraYNc8E6kywBap5MqbzUYt384xpRzieUSmCChkupZJJpuAjxCA4kwXl?__cft__[0]=AZVjT9GHIM-KRYAjLa5-e7p1AFQWPCii9imzlT8W1X8uPCL65lwKF1PrvGYsuvamV4Wl_Dq4DQq3H1ejb6ovNvqI-yduE-FDOsBIDB6kbkXjzzKctahuIKoOSvkzNVlTXTXh2Rpu1JLfKCUpjg24f-_C-VoSRN3JTUCTDwF5fuIpLrLs0RFMJZmUcocTHF-07PPwppHEVwYm7ZATflBGMBQVITP0UjTbpBYSGkZ0xAkajSf2pS3ba43Gl9nfqT-hupI&__tn__=%2CO%2CP-R,207,0,positive,207
pfbid0dpNVK3pGEnckC12XncbHhfDVJdvTGeekKhAaRU2DuNbTQAChmPkvP4bYmJeyRG9cl,Meta AI,5,62,9,0,0,0,0,0,71,3,"Our Meta research scientists and software engineers recently held an AMA about No Language Left Behind (NLLB), an advanced #AI model that can translate 200+ languages. A researcher who studies the Arabic dialect was amazed by the care and effort we put into including the language. They were curious about what the team found challenging during this process. Honestly speaking, it was difficult to find data — specifically parallel and monolingual data. With the lack of parallel data, most translation directions with Arabic languages were zero-shot, and NLLB overlooked differences between Arabic dialects at times. With limited monolingual data, we weren’t able to train NLLB as efficiently. This also impacted the data cleaning/filtering pipelines. This shortage of data is reflected in our performance numbers and our “Dialectness level” comparison between generated and original content.Be on the lookout for more Q&As and check out the entire conversation  https://bit.ly/3Qdoaok",2022-08-11T00:00:00,['blob:https://www.facebook.com/9aa312c4-b022-42f0-ae4a-aa0699467727'],,https://www.facebook.com/MetaAI/posts/pfbid0dpNVK3pGEnckC12XncbHhfDVJdvTGeekKhAaRU2DuNbTQAChmPkvP4bYmJeyRG9cl?__cft__[0]=AZV9QQMrCjsN39xdhTZjGitYIAB3CmUYBimjhOaGtOadQER9bmIocr7hkjkM4Wh9rUQyb-C0Py3Id5B7O_uiTEdnAfQS87UNm8M1jJUboFizHXO3rMydgKapJUarqtTxTqgmEByUs5cgtTDSMFo2CcQ6ZyrEre_8E1IjzpcmEUMsectv4WAcAbS9l85aQMIyEZAXa1Qvqt56ANGpN9yziOuKlSQ_VKAIdcmwHUsrGpbrUA&__tn__=%2CO%2CP-R,76,0,positive,76
pfbid0QH3NzuA2AoDp4aB8CZ7AxPFUwSAQ3NvvbW8MBb8zzZx986kUZmKaCACVzfvwPYnWl,Meta AI,12,99,16,0,0,0,0,0,115,3," Meta is thrilled to be at #SIGGRAPH2022 IRL! Join us and try hands-on AI demos, hear about exciting career opportunities and chat with our team about all things AI. Booth 711 Now through August 11",2022-08-10T00:00:00,['blob:https://www.facebook.com/25afd96d-89a6-4825-8124-4a85b02ba151'],https://scontent.fcai19-7.fna.fbcdn.net/v/t15.5256-10/297615325_125633906688212_8433852510420451349_n.jpg?stp=dst-jpg_s960x960&_nc_cat=111&ccb=1-7&_nc_sid=ad6a45&_nc_ohc=PY1KYDtB6J8AX_zYRFv&_nc_ht=scontent.fcai19-7.fna&oh=00_AfAvLm7ErRdswEhBSVqbmHQdZhVhUwBSlkly_17fAVATFg&oe=64E2673F,https://www.facebook.com/MetaAI/posts/pfbid0QH3NzuA2AoDp4aB8CZ7AxPFUwSAQ3NvvbW8MBb8zzZx986kUZmKaCACVzfvwPYnWl?__cft__[0]=AZXY00KYTTN_yVQxc-o9_dwjxq9pLnaVqJfa-nz77wLhkVUCmflCV-YiKaut-0v1uehnqRuA0HE3REd9Pr5iBV8OJKWjYEAtJ09A9waugL2Q9V8A8NUydpvWKFA-Cu81xIXHXLe6_biTb2D8TmYiO2TMYUQFE2hVSt8ev5P9i4iRvehBqXxO135i7pDoAAzN4zkng7b6E5Pnhm1MbhCiAWP5r5SXN3M9GOHEwnIUhGTRvg&__tn__=%2CO%2CP-R,127,0,positive,127
2178527385657536,Meta AI,49,245,31,0,0,0,0,0,276,10,"Models are increasingly data hungry, but do we really need all that data? Surya Ganguli, Ari Morcos and team show, in theory and practice, that we can beat power law scaling and achieve exponential scaling regarding data if we can appropriately rank the importance of each datapoint.Here we introduce a simple new unsupervised approach to data ranking that’s competitive with previous expensive supervised approaches. Our work demonstrates that simply collecting more uncurated data is highly inefficient and can be dramatically improved. https://arxiv.org/abs/2206.14486",2022-08-08T00:00:00,[],https://scontent.fcai19-7.fna.fbcdn.net/v/t39.30808-6/298054626_2178527378990870_9127400481575718128_n.png?stp=cp6_dst-png&_nc_cat=101&ccb=1-7&_nc_sid=9267fe&_nc_ohc=1yXUbqKSnYIAX8k600Y&_nc_ht=scontent.fcai19-7.fna&oh=00_AfB2NtI9YDBn5nmjqW0V3Muo8gQI9ofhmtUGyumm0JaiWQ&oe=64E34CF3 https://static.xx.fbcdn.net/rsrc.php/v3/y9/r/Z-dbClQDXLv.png,https://www.facebook.com/MetaAI/photos/a.360372474139712/2178527385657536/?__cft__[0]=AZX9PYRrKEoeSr_76c3df74ufK_b7Hni7pmPb1kUCSa41WHMjBCq_FKfWqpJRwDimSUdb9OYrGc_3cuiY9oVtlIiFVh-bQI57Iza4TteaSD5H2rtcACws1LFF1CttPbADpUFXbBK4tAFd4n1NK9MF_c2W0ONXAp2NXBGQG2QoPQ4RshjcKtZKtDk6J2J91oRfQGUFoMbHg9lreWcE15hGiLs&__tn__=%2CO%2CP-R,325,0,positive,325
pfbid08kVgPhcSqSbgVg6SXN41AttU3Sy1BLDEZ9s8hnDp1HaEabH56JjsjtWQBmeHHGPrl,Meta AI,31,151,13,0,0,0,0,0,164,7,"Today we’re introducing Atlas, a new retrieval-augmented lang. model with strong few-shot performance on question answering and fact checking tasks. w/ only 11B parameters, Atlas outperforms a 540B parameter model by 3% w/ 64 training exs., reaching 42% on NaturalQuestions.World knowledge presents a particularly tricky challenge in few-shot NLP, where models don’t just need to understand what the task is asking and how to generate an output, but must also store and precisely recall from a huge amount of information to do well.While small models can do few-shot learning when world knowledge isn't needed, so far only very large models have shown good results on knowledge-intensive tasks like question answering & fact checking. Atlas as a retrieval-augmented model can often outperform such models.We find that Atlas outperforms much larger non-augmented models on few-shot question answering (NaturalQuestions and TriviaQA) and fact checking (FEVER), and is competitive with various very large models on a wide array of real-world exams (MMLU).Atlas has other benefits too. Retrieved passages can be inspected for better interpretability, and the corpus that Atlas retrieves from can be edited, or even completely swapped out, which enables Atlas to be kept up-to-date without needing to be retrained.Lastly, we also show that Atlas is very strong in traditional full training set settings, setting new states of the art on NQ by 8%, and TriviaQA by 9% and on 5 KILT tasks. Read our paper here: https://arxiv.org/abs/2208.03299",2022-08-08T00:00:00,[],https://scontent.fcai19-7.fna.fbcdn.net/v/t39.30808-6/298378472_2178510552325886_7235969937931599773_n.jpg?stp=dst-jpg_p180x540&_nc_cat=105&ccb=1-7&_nc_sid=730e14&_nc_ohc=mOIFC6e_hh0AX9OfiLF&_nc_ht=scontent.fcai19-7.fna&oh=00_AfB_uFcSmbqUcPpr7pCOEuN5e7Goa9lF96mpg3Sx4pexjQ&oe=64E399D5,https://www.facebook.com/MetaAI/posts/pfbid08kVgPhcSqSbgVg6SXN41AttU3Sy1BLDEZ9s8hnDp1HaEabH56JjsjtWQBmeHHGPrl?__cft__[0]=AZVNMOayVmC0YpxonlNhbkzWG65ZBQu2XF-xgXEu4qWO4KvRnE3Nsrx1z9AqAUgCMXyiQwwy9eFrS-ADYiezAIg7W41re56UZFVhuB50dyb5ZaWP_RBn9_PQHgHRC5Xx5GLLeLLCQ9ROwiGlXizaB6QYq_F7uDrVFHfcauzJ1U3cjKaRzAtD-yCf6j1zNT4b5n1GkmxEr0bimPWHvtilpJBb&__tn__=%2CO%2CP-R,195,0,positive,195
pfbid0xh6NYbH8DSTuGgR75FL45Rc15MKbSsiWki36zMKqwQFP5n3q6CQgV7hCH3PmW3N7l,Meta AI,13,71,8,0,5,0,0,0,84,10,"Meta Research Engineer Oran Gafni chats with Mike Schroepfer about how Make-A-Scene differs from other models. By adding a simple sketch to text prompts, we’ve created another layer of control to generate even better images. Watch the full interview here: https://bit.ly/3OXPk1d",2022-08-05T00:00:00,['blob:https://www.facebook.com/f27e3982-d27e-4b04-80eb-50fda9b2ee05'],https://scontent.fcai19-7.fna.fbcdn.net/v/t15.5256-10/298010848_349323897408457_4413124986666544538_n.jpg?stp=dst-jpg_p180x540&_nc_cat=101&ccb=1-7&_nc_sid=ad6a45&_nc_ohc=lFMUHZiK-7kAX85pBHk&_nc_ht=scontent.fcai19-7.fna&oh=00_AfBU-7orQHSfcM2NGwaYocWlXR12xQARCjJL07zdC1IuNw&oe=64E37919 https://static.xx.fbcdn.net/rsrc.php/v3/y9/r/Z-dbClQDXLv.png,https://www.facebook.com/MetaAI/posts/pfbid0xh6NYbH8DSTuGgR75FL45Rc15MKbSsiWki36zMKqwQFP5n3q6CQgV7hCH3PmW3N7l?__cft__[0]=AZU5s2ppCj6qPWJWDA3lysdybCbZrn7q5Oe5MAAq0FBKKGglcesbU9bqRFQmKPFP0GeEntB7JW5Mr9jeBAxR2GgKkOLJyNmzP-veBmjv1LWwt6_1C_pJgF29pUE_d7mFw5wXWTEoEzTPY8tVDqaN4XcBIjxdaNaJLWXIqymXhc_Xxad9FkH6VgDSmqxF3xtpvQzWaEdQfxl3PEIzUvy7JdkWCFIRpy_nqlIXqr0W2RRvfQ&__tn__=%2CO%2CP-R,97,0,positive,97
pfbid026SLBGd93mCpvsyDtGbP8RuHV2ssTwkR6deJZFK7Y52kqWi2JdwqtNocPtKhbxDol,Meta AI,7,46,6,0,6,0,0,0,58,1,"Like AI researcher Angela Fan, we want tech to be inclusive by default, and we don’t want there to be a case where knowledge is only available for those that speak the most popular languages. #NLLB aims to change that and make technology available to everyone all over the world.",2022-08-05T00:00:00,['blob:https://www.facebook.com/45a2ab94-ee35-465d-8da7-8630b87b4b1c'],https://scontent.fcai19-7.fna.fbcdn.net/v/t15.5256-10/296883397_2171137459724691_6588163433768158846_n.jpg?stp=dst-jpg_p180x540&_nc_cat=108&ccb=1-7&_nc_sid=ad6a45&_nc_ohc=Z-oYeNZ1cPUAX9ft5Gh&_nc_ht=scontent.fcai19-7.fna&oh=00_AfBxjrudLTu16CVVzM3HuQgWg0a7qzEE72i1p-jTpkZkGQ&oe=64E41604,https://www.facebook.com/MetaAI/posts/pfbid026SLBGd93mCpvsyDtGbP8RuHV2ssTwkR6deJZFK7Y52kqWi2JdwqtNocPtKhbxDol?__cft__[0]=AZXwUXVhbm2_G2NC2I0CVnVG0Ta7YmO3LQA-_28zY4aGz-cZkUGCKZCN8ynpovJ-ilaPkzJDmHFW748Bbf2YV6uXW1Hr1yV9i80Sw3Of41gvTRxZqpFR1sfOgzDDrgWjkNMVwZiBj_8SPyxGQbR65u1KKO7HnvDccZKsP_XFipSFIJ3zg-beHRKiC75mBgYwR0-hjBQw893Mz3fPYEeE_8VXX5ZGQjD1siK5477LQGKRHQ&__tn__=%2CO%2CP-R,65,0,positive,65
pfbid0DQa6dfRzrXXXyznV1Fc9t13hZDDzVsEnXP7XSWeYkTsBPgNjXgjGrYuArtwsrmt5l,Meta AI,33,145,17,0,0,0,0,0,162,39,"Meet BlenderBot 3, the first publicly available 175B-parameter chatbot with model weights, code & datasets. It can chat about nearly any topic & is designed to learn & improve by conversing with people in the real world.A focal point of our research is enhancing safety measures for chatbots. We developed new techniques that enable learning from helpful feedback from people, while ignoring people who are trying to trick the model into unhelpful or toxic responses.In addition to sharing the model weights and code, we’re publishing new datasets and model cards so that other researchers can leverage BlenderBot 3 in their own work. We believe this open research approach will accelerate progress in conversational AI.The demo we’re releasing today doesn't just showcase our research; it’s part of the research. Participating conversation data will be shared openly so people can contribute & work together with the research community to make models more responsible & useful in the future.Try the interactive demo: https://bit.ly/3QiD78z",2022-08-05T00:00:00,['blob:https://www.facebook.com/cffc92c8-251a-48d3-80cf-d76000a17898'],,https://www.facebook.com/MetaAI/posts/pfbid0DQa6dfRzrXXXyznV1Fc9t13hZDDzVsEnXP7XSWeYkTsBPgNjXgjGrYuArtwsrmt5l?__cft__[0]=AZVbHrhcdnotsmdPUjSae-5gpUjIcBeMsn4zt9yhb_YiP_dp38ZyWcc3fbwdhJSYJITGfF07Mr2aWfAsR0XiEHr6cjbscQ5zqiK17QJZHPXQDqOs1gD4YULL_2EPr6ZgO-RHfqc1bJaElE7GgtQJIDjWXg3p1WkrRq6l7ivG7XSt-NzAyOIk-f6ZBCKoxzMiGy07lVj0WFloMygCVovOrB3i45-7dF7bGWe0W6erRIjOUDhq9-SpZNnoQ8MUZbIZfFI&__tn__=%2CO%2CP-R,195,0,positive,195
pfbid02cK7QyttB34Nkn2y5qcacNtarYqNKRf9aztbpUEEWKTNWNh7uUs5WqHXBjm6qGWKkl,Meta AI,5,61,4,0,0,0,0,0,65,2,"In our recent AMA about No Language Left Behind, our researchers were asked, what is the procedure to extend NLLB-200 to a new language? Do you have any experiments on incorporating a new low-resource language onto the final NLLB-200?: Typically, we extend NLLB-200 to new language pairs rather than a single new language. We finetune the model after gathering seed training data and a reliable test dataset of sentences translated for the new language pairs, if available.If we need more accuracy, we’ll try sourcing better quality seed bitext training data using human annotators or existing translated texts. Alternatively, if we can source sufficient monolingual data in the new target language(s), we’d use data augmentation techniques such as back-translation or additional self-training using the mBART denoising autoencoder objective to get an even better fine-tuned NLLB-200 model for the new language pair(s).Lastly, we check for domain mismatches between the general domain covered by our training data and verify that it is not highly different from our test dataset.If you’re interested in learning more, we’ll be sharing more top Q&A’s. Also, you can read the entire AMA here  https://bit.ly/3Qdoaok",2022-08-04T00:00:00,['https://video.fcai19-7.fna.fbcdn.net/v/t42.1790-2/296625687_747176426398971_3495185581530781171_n.mp4?_nc_cat=100&ccb=1-7&_nc_sid=985c63&efg=eyJybHIiOjMwMCwicmxhIjo1MTIsInZlbmNvZGVfdGFnIjoic3ZlX3NkIn0%3D&_nc_ohc=4CrWvUd_mOkAX_ja8UW&rl=300&vabr=106&_nc_ht=video.fcai19-7.fna&oh=00_AfDmx70oUM4XhLnzySWBsY1IFbnwYHW_po-AEhSybg4rJg&oe=64E3D05E'],https://scontent.fcai19-7.fna.fbcdn.net/v/t15.5256-10/297079133_1056494755038788_2308056406094640769_n.jpg?stp=dst-jpg_p180x540&_nc_cat=102&ccb=1-7&_nc_sid=ad6a45&_nc_ohc=DL2TVVC8SfsAX_5_v6w&_nc_ht=scontent.fcai19-7.fna&oh=00_AfC-20AQmBHzvrvttSPJv_zQRVRljxLRLfXKSWN2Psy0jw&oe=64E25C40,https://www.facebook.com/MetaAI/posts/pfbid02cK7QyttB34Nkn2y5qcacNtarYqNKRf9aztbpUEEWKTNWNh7uUs5WqHXBjm6qGWKkl?__cft__[0]=AZVTjSMdYKpYy2tAQL1sqYCXb9hWYGPd3qr8j7geOzG_npp0w0D4AD2XKk0MF_9QVMYQ_NqeJjwrA4vd3xHJd2KMwytHXk2etoNP2cJ0fWnZmXL2p1AsRjv5LIFxPU_LJYahlwf6MOXapedGjAuGRQJ2Hpz7IcfrRorWaZzf3LNcHVk3U47TVtEjHnKlZ3S9zt2L0n6DX5tnyWw-yGEf0hZWjkAsHeu1k7QB3oRmyInwfA&__tn__=%2CO%2CP-R,70,0,positive,70
pfbid02ZDngR7cEeyRJ3ZT4G2RgMQxAcbtxoh8jZA22vkEREoShB9eCTdc1gRoasUt6Lpnbl,Meta AI,6,57,7,0,0,0,0,0,64,3,"What if the internet was a place where everyone could communicate with anyone? In this short clip, @Schrep and Necip Fazil Ayan talk about #NLLB and opportunities of the future where people could consume any info on the internet. Watch their full convo: https://www.youtube.com/watch?v=xbDZRy8pH8E",2022-08-02T00:00:00,['https://video.fcai19-7.fna.fbcdn.net/v/t42.1790-2/296342227_576408140698066_44984724056203798_n.mp4?_nc_cat=106&ccb=1-7&_nc_sid=985c63&efg=eyJybHIiOjMwMCwicmxhIjo1MTIsInZlbmNvZGVfdGFnIjoic3ZlX3NkIn0%3D&_nc_ohc=knCdVmJSZ-kAX8qOC6e&rl=300&vabr=128&_nc_ht=video.fcai19-7.fna&oh=00_AfAWHpPm-jrflV75ckGPdU2sSdSNjxaIUxsTyAjxyJmAfA&oe=64E32AD2'],https://scontent.fcai19-7.fna.fbcdn.net/v/t15.5256-10/297170570_141759471867018_473832776654371540_n.jpg?stp=dst-jpg_p180x540&_nc_cat=110&ccb=1-7&_nc_sid=ad6a45&_nc_ohc=i1ALXu80Gf8AX9W8aJb&_nc_ht=scontent.fcai19-7.fna&oh=00_AfDLEQFDa1kUPqG6WqFSsGF487o75mfqwabfZ5xLnG3CdQ&oe=64E32574,https://www.facebook.com/MetaAI/posts/pfbid02ZDngR7cEeyRJ3ZT4G2RgMQxAcbtxoh8jZA22vkEREoShB9eCTdc1gRoasUt6Lpnbl?__cft__[0]=AZXiCq6Dx4UoDNSy6d9doU_fS9puLGNlB-t3DWJs73ZxBaF_Rhp47tFZr56gWVHevVfwu8CmXEfKcjGIZeJZrEyoCKxX-fWNZDfhyI9gavkdpcZ3ZeSwpUHTpsbqRJbAdm-2VGkZQY7uDWx_9S8nuck-mDWsThAtl4YVak-y1wkRxEBiO8w_8Usp_zJUoNukb7v8MYJOCkrFkpHcK3mEz7uRyMCQ9FCXGWiVcaV3-8c3-A&__tn__=%2CO%2CP-R,70,0,positive,70
pfbid0fw1nCePAo1aKykop96oW32Bai6g6hjaEZfSb1WJHjmaJkcv5Hy1UgQymtNPcDggUl,Meta AI,6,59,9,0,0,0,0,0,68,3," ICYMI, we held an AMA about No Language Left Behind, a first-of-its-kind project that open sources AI models capable of delivering evaluated, high-quality translations between 200 languages.Our researchers were asked, 'Do you think it will be able to reasonably parse structure of a new language/dialect?'In fact, our multilingual model is quite good at adapting knowledge from related languages for parsing dialects. Completely different languages are harder to get a decent level of quality, but broad linguistic properties and borrowed words like “computer” help the model learn.If you’re interested in learning more, stay tuned for more of the top Q&As. Read the entire thread here  https://bit.ly/3Qdoaok",2022-08-02T00:00:00,[],https://external.fcai19-7.fna.fbcdn.net/emg1/v/t13/3827820518576861551?url=https%3A%2F%2Fexternal-preview.redd.it%2FerSkVe26r53ts0X4wHscPbpHhaioJnJunqIAZrrtv5w.jpg%3Fauto%3Dwebp%26s%3D25541ad372d97877c36b1151e7f2068dabef1b04&fb_obo=1&utld=redd.it&stp=c0.5000x0.5000f_dst-jpg_flffffff_p500x261_q75&ccb=13-1&oh=06_AbHpgqsVtcWdvhSEzoxbXymbE0-MhCFakk-lA4Y3D7WpiA&oe=64DFF582&_nc_sid=dbad39,https://www.facebook.com/MetaAI/posts/pfbid0fw1nCePAo1aKykop96oW32Bai6g6hjaEZfSb1WJHjmaJkcv5Hy1UgQymtNPcDggUl?__cft__[0]=AZWx4IkQGqf8aMKKEpDLwgwss-XryZwbVQ1JCbdBuL2n3_9ukgNMc8jFUboL_h3t1QUV2suh8f0a5YCU_q8inSEU9GlIYn6pmdCgrBuXsWVxv24Eak5aGp-JGdYHsGwmDZyYRDmiJJkZUYkht0SsA7Kx2flAqwMPyJjdzcJswMa6qrk7uwKE6OJgp5qPfWBpD2w-OozXKRimtooPjaeYNJN-&__tn__=%2CO%2CP-R,74,0,positive,74
pfbid0yvqxUyn9zRYfWZACfEeNESHg4pm9u4uV4jpbp275TRhNtUiSWrVr37KvWzAWMYP9l,Meta AI,5,65,5,0,0,0,0,0,70,4,"We’re sharing a new approach for building #CV systems that can more accurately recognize a wide range of common and uncommon objects.By using a simpler Transformer architecture together with Mask R-CNN and self-supervised pretraining, our ViTDet system outperforms previous methods. Learn more: https://bit.ly/3zOd2sB",2022-08-01T00:00:00,[],https://www.facebook.com/,https://www.facebook.com/MetaAI/posts/pfbid0yvqxUyn9zRYfWZACfEeNESHg4pm9u4uV4jpbp275TRhNtUiSWrVr37KvWzAWMYP9l?__cft__[0]=AZWJwgsy9h7frcZa0_5kaS-9HQb9uIGhCIzh-PGVt1gj8OTwbNdKeCIk3PCv0vgYWftDChIazGyN2XBHTeMGJPaRjA4of-yGp9AL6BA5_JrOAkhiIo-WF62aAjkm5EjymGr9IdbbfNDLFZrGxKvl4f-oPZ_Zt4dwH7Tez8kwD5t_-uQgB1z_FW1M17_qbOTcbAP3gN8AzdWJFshI0-cgU5Xi&__tn__=%2CO%2CP-R,75,0,positive,75
pfbid02bstDZ5YEaqSXsW4nozVDZTTRxTDFwKbzGQk3oba9yNu9KtskTdGV54ebUJNomzvGl,Meta AI,15,101,15,0,0,0,0,0,116,6,"We  accuracy in translation . Ever been in a situation like this, where a good translation really matters?Our NLLB-200 model can deliver high-quality translations directly between 200+ languages—including 150 low-resource languages. It aims to give people the opportunity to access and share web content in their native language, and communicate with anyone, anywhere, regardless of their language preferences.Learn more about No Language Left Behind: https://bit.ly/3S6uW0Z#NLLB",2022-07-29T00:00:00,['blob:https://www.facebook.com/65fa2d54-180e-4852-bcd1-7acb797946cc'],https://scontent.fcai19-7.fna.fbcdn.net/v/t15.5256-10/296161793_742109550441955_2570228080634504818_n.jpg?stp=dst-jpg_p180x540&_nc_cat=103&ccb=1-7&_nc_sid=ad6a45&_nc_ohc=QxFkzzTlGnsAX_l3Ri9&_nc_ht=scontent.fcai19-7.fna&oh=00_AfACtfU_JRJ68VnvLN-wKKXZv7gVzzNZTD6R2ePl9VRx1A&oe=64E27342,https://www.facebook.com/MetaAI/posts/pfbid02bstDZ5YEaqSXsW4nozVDZTTRxTDFwKbzGQk3oba9yNu9KtskTdGV54ebUJNomzvGl?__cft__[0]=AZVn7ULJR_CqOMo08NkdmsK1l1Lw0qQX9ZFcm90UhA0Ycidk5pD0QK5ADLwtWOQrOMgVFq-TrLX-Guw_ELK9mNDWrPvL83AQd2v_uZikk8sw8tNy_Lmur1Jf3WOIghfiCtN5gwd2X7IqovC6AWARVLymjeYw5vDqgc7g8Bh29a85SzXySKNmPGI7b7jv1ntU_MzhGPtM3ktgco_RhHTC9odcZhgZg_ZEbwdpqKTQqyDtnA&__tn__=%2CO%2CP-R,131,0,positive,131
pfbid02iv7RutNtfiZcicekJ7chsJ9Bwu6SFEG7BWf3e65qkjak2sj7AnfLU5javznihw6cl,Meta AI,3,61,8,0,0,0,0,0,69,3,"To help Meta better understand how people across different ethnic and racial groups experience our products, we are launching a voluntary survey for people in the U.S. who use Instagram. The survey uses sophisticated encryption to prevent anyone, including us, from connecting individuals with their survey responses.",2022-07-28T00:00:00,[],https://www.facebook.com/,https://www.facebook.com/MetaAI/posts/pfbid02iv7RutNtfiZcicekJ7chsJ9Bwu6SFEG7BWf3e65qkjak2sj7AnfLU5javznihw6cl?__cft__[0]=AZWAx4x-lJxEdgaTFlZBClr0w4oQrgo23tLK3c0U9vtrS16LaN8wLDu7Oig5eQCpHQaersypUUjj3eZZ8px2IgV6m1sK3t3ikf--mxj6IvkjJTBV31xA9KMnJl0twdCZdWIuyFufa-nbBVGyoMgQcwpL7B2w2szJ9UwWSmFJiZswVUeXrlLWvyV3kRGh__SMQlqLprsjjaSU4LwU_oMPRG0a&__tn__=%2CO%2CP-R,72,0,positive,72
pfbid02i9Z4Hxok4AYmY253gbZy4JhgzsuRQsUDY3wXABSZN5AoLZyPpmtphntp2QMTkoU2l,Meta AI,16,73,16,0,0,0,0,0,89,3,"+44% BLEU performance improvement over the previous state-of-the-art model. Meta AI’s NLLB-200 model translates across 200 languages with state-of-the-art quality. Its newest evaluation dataset, FLORES-200, measured and confirmed this with the quality of translations exceeding the previous SOTA by an average of 44 percent. Read more about the high translation quality of the NLLB-200: https://bit.ly/3zcjLuJ",2022-07-27T00:00:00,['blob:https://www.facebook.com/2baa211d-77a0-4987-ac2d-0458605d90e0'],https://scontent.fcai19-7.fna.fbcdn.net/v/t15.5256-10/295478550_584894289921445_2350769105315597313_n.jpg?stp=dst-jpg_s960x960&_nc_cat=101&ccb=1-7&_nc_sid=ad6a45&_nc_ohc=mea9NvYtib0AX-RQi3R&_nc_ht=scontent.fcai19-7.fna&oh=00_AfCi8tsVmjL7ACHncWE39lrOOgJPlQ1_fznAoQ5DMzYolg&oe=64E43916,https://www.facebook.com/MetaAI/posts/pfbid02i9Z4Hxok4AYmY253gbZy4JhgzsuRQsUDY3wXABSZN5AoLZyPpmtphntp2QMTkoU2l?__cft__[0]=AZWDRekJ9qg9NCETxYTO29kFimuaioYTz54Mbrn8USp5iinXJdumxTu65kTSX42IUlHClSMGfL2dyFS4ZqowicswH54mIwIPFRFa8LGp4tLZPIz4Kue7elCnGRVIe7OH2QLqrrrtXxJ4-OT385z5NLQE4j6CPJigtj-XAo63f1VLDRIIvPhwXW8IAIoW-EUHFicObQEz3RHLF9_-shge5fgSxfJ87--THQNlqbzIEoPxYg&__tn__=%2CO%2CP-R,105,0,positive,105
2168976356612639,Meta AI,107,255,33,0,0,0,0,0,288,7,Are you tired of manually annotating vast quantities of data to achieve good performance? Our Masked Siamese Networks (MSN) is a self-supervised framework for learning image representations.It's a new state-of-the-art for self-supervised learning on this benchmark while using nearly 10× fewer parameters than previous best performing approaches and 100× fewer labeled images than current mask-based auto-encoder.Read more: https://arxiv.org/abs/2204.07141,2022-07-26T00:00:00,[],https://scontent.fcai19-7.fna.fbcdn.net/v/t39.30808-6/295180926_2168976353279306_4813441074656977499_n.jpg?stp=dst-jpg_p180x540&_nc_cat=109&ccb=1-7&_nc_sid=9267fe&_nc_ohc=7unEAscA-DQAX-qFH6h&_nc_ht=scontent.fcai19-7.fna&oh=00_AfAfpm_Srn0VNlvauPBhgYLwqN2d0FRufIob4qEtBwfRmg&oe=64E3B987,https://www.facebook.com/MetaAI/photos/a.360372474139712/2168976356612639/?__cft__[0]=AZWk4N6z71ig0XDjPRmgBw-yJdtoMPzaAFuMe12faBVLuC5UFafqh4-_pz7Dcm3mrZDF-iUlqua4VCYCR3HwyfluaHyqIRE84tJhvcQlmuoEibiNnye4kKyjwePzng_H6QUTbhOa-EnT6jkJKKopsX2M_AsqUFKgx5K6utTmijU8fjDVm-NYvlKqwQhhNWL50LvSTYkeeXzk-j5ynppMrmGp&__tn__=%2CO%2CP-R,395,0,positive,395
