id,name,shares,likes,loves,wow,cares,sad,angry,haha,reactions_count,comments,Summary,posted_on,Video_URL,Image_URL,URL,Positive_Reactions,Negative_Reactions,Sentiment Analysis,Rating
pfbid0k54Kc7HoMLQXGw173H2xyBZ4t22KTQKWzjLtSqpkzwKzr5RbM2h1dYh92KEAi74xl,Meta AI,6,60,5,0,0,0,0,0,65,3,"Out of the world’s 7,000 languages, #SpeechRecognition works well for only a small fraction. Wav2vec and #AI are changing that. Self-supervision and less reliance on labeled data can make speech tech more accessible and a key to the #metaverse. Learn how at https://ai.facebook.com/research/impact/wav2vec",2022-01-25T00:00:00,['https://video.fcai19-7.fna.fbcdn.net/v/t42.1790-2/272639597_633081061138302_2815225835595557014_n.mp4?_nc_cat=102&ccb=1-7&_nc_sid=985c63&efg=eyJybHIiOjMwMCwicmxhIjo1MTIsInZlbmNvZGVfdGFnIjoic3ZlX3NkIn0%3D&_nc_ohc=9nmQOqbwlaMAX_pqbpq&rl=300&vabr=115&_nc_ht=video.fcai19-7.fna&oh=00_AfAHmB6AYZHcE7BC_bXcFkczJMTpzsXK7_9w51Iv50KJQA&oe=64E37BF5'],https://scontent.fcai19-7.fna.fbcdn.net/v/t15.5256-10/272583619_4733869253363149_9189772586032872582_n.jpg?stp=dst-jpg_p180x540&_nc_cat=104&ccb=1-7&_nc_sid=ad6a45&_nc_ohc=RURc8aNVQd4AX9d445w&_nc_ht=scontent.fcai19-7.fna&oh=00_AfBm76N2m65AIq-2FfRjOdgf9NJQk1u0749_1jwruaE4qg&oe=64E365A5,https://www.facebook.com/MetaAI/posts/pfbid0k54Kc7HoMLQXGw173H2xyBZ4t22KTQKWzjLtSqpkzwKzr5RbM2h1dYh92KEAi74xl?__cft__[0]=AZVsKOaGqiSX6SKA5a6RNy3yLN5JeZwAo9zTNhYyqe3NuidxrI3Qmw_kraVQDFGzZfiGOjsCqnj08KWG8zSZNUpp6Jo6zaq_4pq1QB6VYXVpuakpZYfUWgzXwwXNv8ukqIFkpqBchBxEFekglUvjxcGmNhaHGGnjALdSdTMZDctIzp1ygsqQeHe9SQ1yXPwOExzI19BsP-9lR-mICkUKjSzAdFGnAF2Pr5IBlpI7ZLD96Q&__tn__=%2CO%2CP-R,71,0,positive,71
pfbid0zViYhyxKRvqJZ9LyqL54RPXsBKEwh9h2VKGvqkvZ1bs9DjDrKdsRt2GrRJoswYRrl,Meta AI,109,319,45,0,0,0,0,0,364,13,"Learn more about Meta's AI Research SuperCluster (RSC), our latest AI supercomputer  for AI research. http://ow.ly/4khz50Hzlvu",2022-01-25T00:00:00,['blob:https://www.facebook.com/f1ce60ae-9821-48d1-9417-4a44dcc433cb'],https://scontent.fcai19-7.fna.fbcdn.net/v/t15.5256-10/272693834_5084276604968201_9148765893356912226_n.jpg?stp=dst-jpg_s960x960&_nc_cat=104&ccb=1-7&_nc_sid=ad6a45&_nc_ohc=L8oZeYiyNEMAX90l7Kb&_nc_ht=scontent.fcai19-7.fna&oh=00_AfDXlqqZGmyOdFxVpqRNDybMY0P-jC6CyOLXw54aa5uzww&oe=64E4114A,https://www.facebook.com/MetaAI/posts/pfbid0zViYhyxKRvqJZ9LyqL54RPXsBKEwh9h2VKGvqkvZ1bs9DjDrKdsRt2GrRJoswYRrl?__cft__[0]=AZUBKe4LwxGIHb6c1qoxwooQbw7BcHtU3Kt0780pJBZRiXU1bN2kBVS24L6-t7SFXebbn8h0HFK8vSQVQ57-fz5mnnuBko36atsMNwyQ8sT9ZgBWyAlP7llPaHcAGtMje2P9yS9AAPYv3O7WSILJRNUGTjOD5tB_eZsTgo69BnRdiroDP0f54WQd1W8kf9tf0hnAQCpJz_O9KDpYP8PDjYKncXcx5ih8WDNhwo0QRr4gmQ&__tn__=%2CO%2CP-R,473,0,positive,473
pfbid02UM9q9qzbsgbWRpPAEMXHLj9u5SAcTd7yV7PFggRLTc7B8v2sgqmeqet1ZyoeFsUAl,Meta AI,16,138,13,0,0,0,0,0,151,5,"Meta is announcing the AI Research SuperCluster (RSC), our latest AI supercomputer  for AI research. RSC will allow our researchers to do new, groundbreaking experiments in AI. We believe that by mid-2022 it will be the fastest AI supercomputer in the world. Learn more about RSC and the important role it will play: http://ow.ly/JMF550HzpqI",2022-01-24T00:00:00,[],https://www.facebook.com/,https://www.facebook.com/MetaAI/posts/pfbid02UM9q9qzbsgbWRpPAEMXHLj9u5SAcTd7yV7PFggRLTc7B8v2sgqmeqet1ZyoeFsUAl?__cft__[0]=AZVNLmkA1SQVHLdvWuYfsf3tfvhfFsNtUoZ8QxpR8D0IYyJ3_DXIoopNqjwtD9-R8--5Y7SNAM2hfpKQJ_dmojxnUwW5X5OPMTyt0ibW_2w4LWbSh-_-lYZydix7ydCq-JLZoKgUnWcUR8su_Q9_eEB2vyXgRSH-f9mWKGTcNkpJ0zrmaIym99svG6A3jVED38VvPvt9ypxoo1oxQGVfbcOa&__tn__=%2CO%2CP-R,167,0,positive,167
pfbid0oLKU1LFEDcdhqFYFjAWdMLGurLm2SuorDf8rpxouhzHwY38ud3PGzBPCjWL4S2K9l,Meta AI,37,175,18,0,0,0,0,0,193,9,"We’ve built data2vec, the first general high-performance self-supervised algorithm for speech, vision, and text. We applied it to different modalities and found it matches or outperforms the best self-supervised algorithms. We hope this brings us closer to a world where computers can learn to solve many different tasks without supervision. Learn more and get the code: https://ai.facebook.com/.../the-first-high-performance...",2022-01-20T00:00:00,[],https://scontent.fcai19-7.fna.fbcdn.net/v/t39.30808-6/272147088_2024182621092014_6532581039236849529_n.jpg?stp=dst-jpg_p180x540&_nc_cat=100&ccb=1-7&_nc_sid=730e14&_nc_ohc=nsuRRinXQmQAX8Ii7Tt&_nc_ht=scontent.fcai19-7.fna&oh=00_AfCXGILOF3UvugATJWt0jR1TBNR0QWulBhwDoocb0zSi8w&oe=64E26446,https://www.facebook.com/MetaAI/posts/pfbid0oLKU1LFEDcdhqFYFjAWdMLGurLm2SuorDf8rpxouhzHwY38ud3PGzBPCjWL4S2K9l?__cft__[0]=AZUAGzDtnggRdxBFK2YkVgh46nSeoHOarhODwk4GCeEfwzcDl8HIP11bDFb926iRDD3uIUWkAVxMSDGt7M7VdYCXigEm6cUGuV7kJkRyuot0-aWpD65hRk76Oh3yBANAwix_wQuXcTgqw24HtonPQaDBiM4SM2UGIrZzkWhDOFAvFUTrc0bJDlTocIhjMjULzag9NIKndWb8xA_I8WCAOUBJ&__tn__=%2CO%2CP-R,230,0,positive,230
pfbid0dKDG6wJSMykgbYFrEc6V9HQYzTqLweMaqhuMtrubepYHTse8qH4Qu3NJiQmxpfAYl,Meta AI,9,45,7,0,0,0,0,0,52,2,"Health, the environment, language. When cutting-edge #AI research tackles real world problems, positive change happens. Let’s build the future of AI, together. Learn how our researchers are making an #Impact at http://ow.ly/eY1z50HyqBK.",2022-01-20T00:00:00,['blob:https://www.facebook.com/cc9eb773-9f2e-46eb-81d4-078153878f52'],,https://www.facebook.com/MetaAI/posts/pfbid0dKDG6wJSMykgbYFrEc6V9HQYzTqLweMaqhuMtrubepYHTse8qH4Qu3NJiQmxpfAYl?__cft__[0]=AZVqutOTl-xaTJOW7nRM3u-jtsofHoQJSyiMFCYMYciF-dLCjTs5RI_7K6TuTX8gw_fxOHVZhpN2jWJJpnJcFfCAJZFKS2k-9N_CuX2LFxz7pAKGJru9hjAOmXLydbYqGsDF4FZ0No5kiI3CLDLNsKv83maH9VuRq2B6xDQOKTcEQebrSQVyhFCKzGh0WenWQvVNf3wKWCt7Mrae-t1Wal0-dt8sRLeMgd8f1GIUepnmIy7OcEgdMTx-3rTW_IFPjdc&__tn__=%2CO%2CP-R,61,0,positive,61
pfbid0NftJ2njAS6NwXnmBX44zgyQd23GbZxgjJFScbCi2pGn2Uj9urg9zYhmb4nsr8YQgl,Meta AI,44,217,0,0,0,0,0,0,217,8,"To help build more versatile & robust AI speech recognition tools, we are announcing Audio-Visual HuBERT (AV-HuBERT), a state-of-the-art self-supervised framework for understanding speech that learns by observing & hearing people speak. Learn more and get the code: https://ai.facebook.com/.../ai-that-understands-speech-by...",2022-01-07T00:00:00,[],https://scontent.fcai19-7.fna.fbcdn.net/v/t39.30808-6/271587663_2014812275362382_4860411816645437897_n.png?stp=dst-png_p180x540&_nc_cat=101&ccb=1-7&_nc_sid=730e14&_nc_ohc=XMhV5yNzP_IAX_r0cCE&_nc_ht=scontent.fcai19-7.fna&oh=00_AfCB5QiEr8X3q6wveJ3ulOa5rZx-fCPx0k6-v6nSDD-YFA&oe=64E34366,https://www.facebook.com/MetaAI/posts/pfbid0NftJ2njAS6NwXnmBX44zgyQd23GbZxgjJFScbCi2pGn2Uj9urg9zYhmb4nsr8YQgl?__cft__[0]=AZU55I5gC-0eUi5rKT6jnHQ5Z6xlfKsb-Lls6tnWyMLQxcjOzSdMohD_H-1W9pxduaYySucq_Oy9AgE7fNy3l6DhtTRrS56cwAM5kWSgbOZHED6RRFa1GmQZx28_4jgSZT5yELx7-q1nMw8Xv6AeDnuOmr_ssYIonPG_KqktE9nxkMGU7hGtpmIguyD7ZlhwK3UY_qTERRrXZYfWaD6s4uG7&__tn__=%2CO%2CP-R,261,0,positive,261
pfbid02BoJeFMzJbPU51iRv57QvfaXuMKAjtnBUV46jfyWLfxxKjNWNMKnuFNV45YGgqbr3l,Meta AI,10,141,13,0,0,0,0,0,154,3,"We’re sharing results of the Image Similarity Challenge, an open research competition to create better systems to identify manipulated images. We’re also sharing a unique million-image data set created by Meta AI. Learn more: https://ai.facebook.com/.../detecting-manipulated-images...",2021-12-17T00:00:00,[],https://scontent.xx.fbcdn.net/v/t39.2365-6/262024062_1498917430465689_9104978084665042390_n.png?_nc_cat=111&ccb=1-7&_nc_sid=ad8a9d&_nc_ohc=HcveFeN1K7wAX_XRoZO&_nc_ht=scontent.xx&stp=c0.5000x0.5000f_dst-jpg_flffffff_p500x261_q75&ur=139b9a&oh=00_AfA6CDkBlx5LUC2qgqYAkqjVQbFLedbtsGtLs-eIoM__dA&oe=64E00B59,https://www.facebook.com/MetaAI/posts/pfbid02BoJeFMzJbPU51iRv57QvfaXuMKAjtnBUV46jfyWLfxxKjNWNMKnuFNV45YGgqbr3l?__cft__[0]=AZXu_VqTEc9-e7huuKum-xff52lpiDw47irfRVynH3yYMgNdVukmPw6FX2tDJGducByQTd-XEn-50v1P8Ek9zDOGRmQ_zWDuKW-IYeUmOxravla6jpb3tAkfqlrB8K0qeXMnZUjmq4VgPIkYB1KeCKl6K_xBSnaZB1gyNeGcFlvaQSOHL0lA5dbdKFi15nNiawOJsYzGqdT4EsNWD4zdYSEp&__tn__=%2CO%2CP-R,164,0,positive,164
pfbid06qyUzbpXKsqzWwJTULqwNuRYacaZmnz6bugjGo3SVoF11rYphR6QdLFuxfbJyASXl,Meta AI,39,169,20,11,0,0,0,0,200,14,"Do you know a child who loves to draw? Have you ever wished that characters in their drawings could “come to life” and move around the page? Using AI, we have developed automatic animation that can bring children’s one-of-a-kind characters to life! Learn more about this research, and submit your child’s drawing to check it out: http://ow.ly/r5CN50HcoF4",2021-12-16T00:00:00,['blob:https://www.facebook.com/72dc816f-eb9c-463e-a772-5991d2bbcca7'],https://scontent.fcai19-7.fna.fbcdn.net/v/t15.5256-10/267376751_941572153138710_4943849787924859759_n.jpg?stp=dst-jpg_p180x540&_nc_cat=107&ccb=1-7&_nc_sid=ad6a45&_nc_ohc=yDzK2ah95WgAX-NJnhL&_nc_ht=scontent.fcai19-7.fna&oh=00_AfA0vhiozf7KrY_583BqVMzlUt9PfASouKE4-mXZLTNp5g&oe=64E2D6B3,https://www.facebook.com/MetaAI/posts/pfbid06qyUzbpXKsqzWwJTULqwNuRYacaZmnz6bugjGo3SVoF11rYphR6QdLFuxfbJyASXl?__cft__[0]=AZWpZAb4Gk1pH6PD2hLTcH9FlQI-vUdsTMZvCYTeNPM2He7TS68q_NlAKmdwPt6c-wSLgxrX0KmTXPImDYiKmz-iN4DoiPlGraHnjdRMc4aw0y5IO-d3CprAfve5CKu9ThBjqgpjQdBevE3UOCVRbAQUaeLMj5AJ14uRd-68hqkY3h5cSnO2bKPEz-eW2-YQbMRxfKzE-FYE53nr-OVl2phQsjKrAXBcwZmAxo1n89P_Mw&__tn__=%2CO%2CP-R,239,0,positive,239
pfbid0KXWCkLKY4F61AokthxLFuVNh35HixU4XRp6JdbZqBm8VVVnSvqwkL73ACwai7pMFl,Meta AI,4,78,5,0,0,0,0,0,83,5,"Correction - Here are today's workshops from our own Meta AI researchers at #NeurIPS2021. For the full schedule, visit our website: https://ai.facebook.com/events/neurips2021/",2021-12-14T00:00:00,[],https://scontent.fcai19-7.fna.fbcdn.net/v/t39.30808-6/267754122_1996777437165866_1100245212945609206_n.jpg?stp=dst-jpg_p526x296&_nc_cat=101&ccb=1-7&_nc_sid=730e14&_nc_ohc=9VOtCb5J2gEAX_eKhvx&_nc_ht=scontent.fcai19-7.fna&oh=00_AfCi52_rzEqGNJPZS2dQEmCGueC9uMG3BH-1YudUxxjSIg&oe=64E26D56 https://scontent.fcai19-7.fna.fbcdn.net/v/t39.1997-6/313423078_421705440150262_134261840010092492_n.webp?stp=dst-webp_s168x128&_nc_cat=103&ccb=1-7&_nc_sid=ac3552&_nc_ohc=Kwxtuy1NtToAX9fIsDL&_nc_ht=scontent.fcai19-7.fna&oh=00_AfCvhXVGXRhVLE4434jXZ2yqshxcrXrfofNX_8olFWKC2A&oe=64E3A99F,https://www.facebook.com/MetaAI/posts/pfbid0KXWCkLKY4F61AokthxLFuVNh35HixU4XRp6JdbZqBm8VVVnSvqwkL73ACwai7pMFl?__cft__[0]=AZWTNwrcSFSHDrYcuavSR8HP9FPWL5nsAH_89L1IImuvb52zh3WSAJF3YUV54m5NXMGIJCj96CLACttCRXsRcjZaSYY-kPNsHVeOxXkn3eIIsNfWljnJElMZtb9WHCuNl7PjmpBFS0xcM3yIHkuglPtA91IlGJ6UhF15Tn6ogX1tagmUB6L5f52Hs92Ih5IcsOzsa66bp7l_XfKrOuUTLvlt&__tn__=%2CO%2CP-R,87,0,positive,87
1995906067253003,Meta AI,5,83,0,0,0,0,0,0,83,2,"Want to hear from Meta AI researchers? Attend one of our #NeurIPS2021 workshops today! For the full schedule, visit our website: https://ai.facebook.com/events/neurips2021",2021-12-13T00:00:00,[],https://scontent.fcai19-7.fna.fbcdn.net/v/t39.30808-6/266762650_1995906060586337_8419515348600765792_n.jpg?stp=dst-jpg_p526x296&_nc_cat=106&ccb=1-7&_nc_sid=2c4854&_nc_ohc=b8kLN22_vAgAX9NBn8I&_nc_ht=scontent.fcai19-7.fna&oh=00_AfDxeQIfVCTRBwJAgbGWQFfPD1qC1JK4gPpQfS7jQs1fPw&oe=64E3D7D1,https://www.facebook.com/MetaAI/photos/a.360372474139712/1995906067253003/?__cft__[0]=AZUXnvp_D7zz7trepfeirlOYoQcOzd7AmKKnf7AgvNbc7037tF6S3bMw0QIQfOZIzEuD6_OCvdS31-yQagsu-5FTRC_watTby0iy8xDFOKBBj3CI1JsxWqpngCiOFaG8WQSP5uBoZiMPLajOY8TUPMtW-tXAvBeMW5sbKkUUAb2jPPZVqmQOx_P_1iqQHQI0jlndgrEIOTk2VXmi0RXRQ2rg&__tn__=%2CO%2CP-R,88,0,positive,88
pfbid02qBZbtN8rHSjezqMZqKn9whqLrZg7cbggZBVekdjaW3opBdPSGf9BnavkxrwLtHDpl,Meta AI,3,146,15,0,0,0,0,0,161,1,"Congratulations to Noam Rozen, Aditya Grover, Maximilian Nickel & Yaron Lipman on winning Outstanding Paper at #NeurIPS2021. Hear from them today at 4 p.m. PST.",2021-12-10T00:00:00,[],https://scontent.fcai19-7.fna.fbcdn.net/v/t39.30808-6/262662226_4610738445684080_41019145435889159_n.jpg?_nc_cat=106&ccb=1-7&_nc_sid=730e14&_nc_ohc=tGyV1Wu-KTwAX8-4LOG&_nc_ht=scontent.fcai19-7.fna&oh=00_AfDgOMc098e9KBNDA5zHKJN_gt32WjezEWBt7465Q6w6Rg&oe=64E37AA7,https://www.facebook.com/MetaAI/posts/pfbid02qBZbtN8rHSjezqMZqKn9whqLrZg7cbggZBVekdjaW3opBdPSGf9BnavkxrwLtHDpl?__cft__[0]=AZU6ocrXz-18mARIDHKcgZLBGlY8h0F8XLbhbA7vJNR1Ac5FfhWTnDgF5pBWCUoD3UMfAQq09jc4w1XsKRF4_Cx8F9N7HrqDrLH__rD2mGypKXDqbmjhIPBQz9aU1RGq81rwaHLdt5zPQV22qVRmZQxirGKxfoavYwq_F9l7X2hTw1i7YZ0Ng6hUu8E8i71mYdsqBWG2c51RRkpL2MlHxp170fSra8FeesiqbKpO845-VA&__tn__=%2CO%2CP-R,164,0,positive,164
1993672127476397,Meta AI,0,78,0,0,0,0,0,0,78,2,"Here's where you can find Meta AI researchers at #NeurIPS2021 today. For the full schedule, visit our website: https://ai.facebook.com/events/neurips2021",2021-12-10T00:00:00,[],https://scontent.fcai19-7.fna.fbcdn.net/v/t39.30808-6/266121327_1993672124143064_2343727602823706829_n.jpg?stp=dst-jpg_p526x296&_nc_cat=111&ccb=1-7&_nc_sid=2c4854&_nc_ohc=qCSEiYnqqfYAX_ogHIA&_nc_ht=scontent.fcai19-7.fna&oh=00_AfCS5kegol6k2DTztwHgXIOWxra5xW8nUqXYcSWquOCwGg&oe=64E2D754,https://www.facebook.com/MetaAI/photos/a.360372474139712/1993672127476397/?__cft__[0]=AZVw9UTCy82qSjvnZOJ9sn0gr-f2hnEZaZRmBWRJihskSlmP5JKsN5HK1GYFajGjoM-NYpIdNkeb5MejLLSPm3zq4R5SOtjZXItMy_tChose0laSsLGbnhUrOYEhm4-s7wQmlCGYrnkPSmE7HAZZnt3AcssaT0UiE9unNLjxm319OsTkD9lDsFMMBi99FvmXrK3BJafhm37wgXASGKnmz4U0&__tn__=%2CO%2CP-R,78,0,positive,78
1992502244260052,Meta AI,23,136,11,0,0,0,0,0,147,2,"Few-Shot Learner is a large-scale, multimodal, multilingual, zero or few-shot model to help us better detect harmful content. It  enables joint policy and content understanding, generalizes across integrity problems, and doesn’t require model fine-tuning.Our new system works across three different scenarios, each of which require varying levels of labeled examples:- Zero-shot: Policy descriptions with no examples. - Few-shot with demonstration: Policy descriptions with a small set of examples (n<50). - Low-shot with fine-tuning: ML developers can fine-tune on the FSL base model with a low number of training examples.Learn more: https://ai.facebook.com/.../harmful-content-can-evolve...",2021-12-09T00:00:00,[],https://scontent.fcai19-7.fna.fbcdn.net/v/t39.30808-6/265428544_1992502234260053_3577394696574939895_n.jpg?stp=dst-jpg_p180x540&_nc_cat=108&ccb=1-7&_nc_sid=2c4854&_nc_ohc=5JTe_oqzfZ0AX8BWOrP&_nc_ht=scontent.fcai19-7.fna&oh=00_AfBPEfU26yYoyh1s2RaktgdbK9vbA5W8pJMtq_EQYjKV8Q&oe=64E3F2F6,https://www.facebook.com/MetaAI/photos/a.360372474139712/1992502244260052/?__cft__[0]=AZXuHi4yKpFrAj126sE659_97_2w-ckG04whXJYQzFQO_3q0deV8Cw57bI0WeYmzzZK30u4ielTs4hXPBrbyL6WrDAyGz_Fm0fXGhsp4OOonhOfL5tEW5qSAsXyT4rKgwkIEmg6m8EAvpfR4PnmF_spsmNvtOb5Vxy9YuMjHgcgblGvfbN7PyNyRFJU8N_qGGO0SI7clteGy4iJQO5XdorXe&__tn__=%2CO%2CP-R,170,0,positive,170
pfbid0V7PDDuvPTTDst1BLkio9mXYw5j5Yg7rYZJ2axxNLAsKr2LVQXw3TdCZHkkCtDx92l,Meta AI,16,67,9,0,0,0,0,0,76,8,How do you teach AI to detect new and evolving types of harmful content -- before there's even large numbers of examples to use to train the model? We've built and deployed a new tool called Few-Shot Learner that can adapt quickly. It can generalize and understand policy violations using just a written description.Learn more: https://ai.facebook.com/.../harmful-content-can-evolve...,2021-12-08T00:00:00,['https://video.fcai19-7.fna.fbcdn.net/v/t42.1790-2/264178965_889763501738487_4479173898382733095_n.mp4?_nc_cat=102&ccb=1-7&_nc_sid=985c63&efg=eyJybHIiOjM4OCwicmxhIjo1MTIsInZlbmNvZGVfdGFnIjoic3ZlX3NkIn0%3D&_nc_ohc=JdJ88X75cAkAX-PIb0q&rl=388&vabr=216&_nc_ht=video.fcai19-7.fna&oh=00_AfBdmsTnHCr86Sy8TJFcUFoBjsWmkCZ9m1AfVH0vBWjtHQ&oe=64E27866'],,https://www.facebook.com/MetaAI/posts/pfbid0V7PDDuvPTTDst1BLkio9mXYw5j5Yg7rYZJ2axxNLAsKr2LVQXw3TdCZHkkCtDx92l?__cft__[0]=AZWT1euwzXRPdPMnwN30pqG__3IEl6lVs94Y2vI4N3e70vc2ywuPQvFClOZWLm9F2_IkpsELiDpcwCtRSMKIF-Oh58Zb3sebqUHSl2Dhxl52QqtOjVzvJ7CsbHlUc8y27-zwe_hwM0rgUDRdV54ayWOY0d2cl-4b8v1OsM4qoveft4gxi_3vcjD005UP6vVOS186Io7ZTm7U7-z_Bz32qn7SZSFd9THlMMZtltYrzYmmpw&__tn__=%2CO%2CP-R,92,0,positive,92
pfbid0DbVYMAYZXbpxPwvpSQWe6Bzrig1xxTCkhPTAN2i6PACYawYMRfZkJo6oGk1aRjNNl,Meta AI,9,176,0,0,0,0,0,0,176,1,"Meta AI researchers are presenting 83 papers at #NeurIPS2021, including eight as spotlights and five as orals. Learn more about wav2vec, Habitat 2.0, and more here:",2021-12-06T00:00:00,[],https://www.facebook.com/,https://www.facebook.com/MetaAI/posts/pfbid0DbVYMAYZXbpxPwvpSQWe6Bzrig1xxTCkhPTAN2i6PACYawYMRfZkJo6oGk1aRjNNl?__cft__[0]=AZWXHtDyrgO0gUbqwV9eTSBQImULGGBdbDEmhhCnWBmawx5zbyeJwH4Tm2DMIgyNGHiqUQd41Wk8mcFkkKCMq1YfR_5JtfYiBJTW6Gutur0XviTipHMSyLL57gxwWotsszjcU7_Bx7Q-97zbVUii-QkN6CTfFzXyKO4y07qUj8uNmPpkSPJkUuyz3EhDG-WpzVcr6kCfxHadsHFeEJoGmGpq&__tn__=%2CO%2CP-R,185,0,positive,185
1990877204422556,Meta AI,18,105,16,0,0,0,0,0,121,3,"Want to learn more about working as a researcher, an engineer, or in other roles at Meta AI? Come talk to us virtually on December 7 and 8! Register here: https://bit.ly/3rBbUFb",2021-12-06T00:00:00,[],https://scontent.fcai19-7.fna.fbcdn.net/v/t39.30808-6/264066118_1990877194422557_4511205184008849006_n.jpg?stp=dst-jpg_p180x540&_nc_cat=111&ccb=1-7&_nc_sid=2c4854&_nc_ohc=i8kD_gRb2bYAX9fWQb_&_nc_ht=scontent.fcai19-7.fna&oh=00_AfDbBLdo2dWxnGVyaj7lAdacgEHp0541RsD6vOqUlNiOVg&oe=64E3D85D,https://www.facebook.com/MetaAI/photos/a.360372474139712/1990877204422556/?__cft__[0]=AZUaNMuSjbv8WegrEWjUgxi2m3pNDI2lZK5rbuLtfBZRXuI47Jy8B-ZcqBu7rTHkH8kYBQYq28P_qiLi4Hjc1IhAovDfnXvhI6xyXYbf72syoZYEEl8VMF4_GBG_EiIXyIhlajlEa9MYEzWFL7JabrU5hIrBVmrZ9qJk8LONo8qwkVZ9ZMos-NG3hDk_LYxp6e-enkFYVIVta-oxeY1At7ev&__tn__=%2CO%2CP-R,139,0,positive,139
pfbid02kzngUbikgQBBFdMZSRAMYqi38PnDh4VrJuUxo6JCigbPHVDTHLcrKVQTcTCVDwnzl,Meta AI,9,99,12,0,0,0,0,0,111,3,Using voice to interact with surroundings will be an important building block of the metaverse. Our two new works show how we can create a conversational parser for on-device voice assistants that overcomes the latency burden of seq2seq modeling through parallel decoding.Learn more:https://ai.facebook.com/.../building-a-conversational...,2021-12-02T00:00:00,[],https://www.facebook.com/,https://www.facebook.com/MetaAI/posts/pfbid02kzngUbikgQBBFdMZSRAMYqi38PnDh4VrJuUxo6JCigbPHVDTHLcrKVQTcTCVDwnzl?__cft__[0]=AZWbh-QvNP3YrHHI3uIrYtrhKrLDoWeIzvzg7bwcyoaAVJzCoHSwGw40KfM4VbW2ib7aFPvePvYTDbbEty7YU3_1ZzACQ2BHt3NQq1au8rT8O1jqpvTlFl8PuGphup4gnPNB3j31JorZU61mGGoQFrGbGJLaipwkY8rdSe_LdcMxwtQpYbtAsVarTyln5_LfAGxeUXSW36FSkRaEy_pEdTds&__tn__=%2CO%2CP-R,120,0,positive,120
pfbid0XZnzQC6W3tBGGaqMSh8BQBk2iDf86zrfiNHLVN1bmfWTzcEBqorppGinzpBGNgrPl,Meta AI,9,60,6,0,0,0,0,0,66,2,"We’re announcing Opacus, a #PyTorch library for training models with differential privacy, is graduating from beta to 1.0. We’ve taken your feedback and improved Opacus to better support research in Privacy Preserving ML and production applications of Differential Privacy. Learn more: https://opacus.ai",2021-12-02T00:00:00,['blob:https://www.facebook.com/a9d95157-d235-48a8-bd66-4a46c8604124'],,https://www.facebook.com/MetaAI/posts/pfbid0XZnzQC6W3tBGGaqMSh8BQBk2iDf86zrfiNHLVN1bmfWTzcEBqorppGinzpBGNgrPl?__cft__[0]=AZWndOEaJifvJfccCY09mJkSp30YGA3dWF3RRRRUjO2WS32vCzusyc4dhtfNP94GB_DsEK3VomqD4HkS-oqwlzP822OWp8Lz6KjoD0jDCVxHHS0RIpKtANDE791410jgQmLVHwYdn34wvRAhS4kFTIFD2nVtHXKlgV6YRcbJrF4iuIF2GwelYYIwFh4ZfjKE_lVNMIL-bBdVTAvuIJTaNgjzDa96OWBGRXO1YaCeNNgSog&__tn__=%2CO%2CP-R,75,0,positive,75
pfbid032BttwivSmC6YJhyuqPeENZC9AwFxFS8m3qp9SXGPLakPfxkyKxyUwvxH731eR6psl,Meta AI,19,92,8,0,0,0,0,0,100,3,"We’re releasing NeuralProphet, a scalable and easy-to-use open source framework for hybrid forecasting models. NeuralProphet builds on Prophet & extends it to industrial applications. Built in #PyTorch, NeuralProphet produces accurate, interpretable time series forecasts quickly. Code: https://github.com/ourownstory/neural_prophet",2021-12-01T00:00:00,[],https://www.facebook.com/,https://www.facebook.com/MetaAI/posts/pfbid032BttwivSmC6YJhyuqPeENZC9AwFxFS8m3qp9SXGPLakPfxkyKxyUwvxH731eR6psl?__cft__[0]=AZX71CpvqVCEgpxoGaHr95F2r68DXIxJiNdDQFQNXIBgAsIO5VVnpERRdil9LC9MEUdS92ls97WNB4HUgw0250r1UdfUdjKPFpgAk5_b4SI_PXtqHGGnAiAzbEVqKRV90p4_xkFqtEk7_LVa5md6x1RgRaCKti2zrCbedmO5qeL55pwzySY2ME6LXUguTG02SdrJ8hSUuemE-nVgkt9bkhtF&__tn__=%2CO%2CP-R,119,0,positive,119
pfbid028a1YB2FvH8AAP984UZCVyhttMhc6pxh3WrrSCTxB26y9bbZLFuApdvN9mgBkq1bDl,Meta AI,0,45,7,0,0,0,0,0,52,4,"The PyTorch Developer Day 2021 Livestream will begin at 7 AM PST on December 1 through our Twitter account (twitter.com/pytorch). Tune in for 30 technical and educational talks, including the fireside chat from Soumith Chintala and Yann LeCun. You can view the full schedule here: pytorchdeveloperday.fbreg.com/agenda.",2021-11-30T00:00:00,['https://video.fcai19-7.fna.fbcdn.net/v/t42.1790-2/261847338_297125605664526_7600808115514687145_n.mp4?_nc_cat=107&ccb=1-7&_nc_sid=985c63&efg=eyJybHIiOjMwMCwicmxhIjo1MTIsInZlbmNvZGVfdGFnIjoic3ZlX3NkIn0%3D&_nc_ohc=M9h55Vuz6coAX9hN1Qa&rl=300&vabr=112&_nc_ht=video.fcai19-7.fna&oh=00_AfBaWXDIUYZZR4edjQBwxfQhDrL1piYgHFULghic2T-8kQ&oe=64E345B7'],https://scontent.fcai19-7.fna.fbcdn.net/v/t15.5256-10/260275750_620069669204670_4785843664086623117_n.jpg?stp=dst-jpg_p180x540&_nc_cat=101&ccb=1-7&_nc_sid=ad6a45&_nc_ohc=j_xU7rk0L2sAX8P-obs&_nc_ht=scontent.fcai19-7.fna&oh=00_AfCeKg-VQeiC303k5bwRBl_obUQnyOwCy7zs_KYmIyyaAw&oe=64E39C5A,https://www.facebook.com/MetaAI/posts/pfbid028a1YB2FvH8AAP984UZCVyhttMhc6pxh3WrrSCTxB26y9bbZLFuApdvN9mgBkq1bDl?__cft__[0]=AZWo2LWLxkaicGJ9WF8HnGYzfKIi4FUqkvn8VtolGj3Z4XV7hq2mKPaJns4NL-H7BqjuzCs4vhC2Lsha0uJqTqieG9KKLWHaf1YPy7iWWdGx64Axq8QANEu0-dRYqtSmoTdAgM-7_shGWENmpdXixtO9nAx41tP0rNz7fO-q4ctlyPtldHrOwWCBt88YnKO087vwNsJ-WUziAqrhbboLO-q31-tg5W-7c48ov-UXU4CVxR0JxX-Az26rW1EOKNzVfok&__tn__=%2CO%2CP-R,52,0,positive,52
pfbid0adb3c8obS9yBnrYVZSZG8Pa7MHpE2TaMZUj7qJPwyVmgGaxCvpPyD4tpt3VUUHN3l,Meta AI,13,98,6,0,0,0,0,0,104,4,"We’re augmenting our open source data set to help surface fairness issues in AI speech models. By adding human speech transcriptions, researchers can test how automatic speech recognition models work for people in different demographic groups. Read the paper here: arxiv.org/abs/2111.09983",2021-11-24T00:00:00,[],https://scontent.fcai19-7.fna.fbcdn.net/v/t39.30808-6/260732785_1982418358601774_5570271787098373806_n.jpg?stp=dst-jpg_p180x540&_nc_cat=105&ccb=1-7&_nc_sid=730e14&_nc_ohc=w_LcD7NwahsAX_4FiCV&_nc_ht=scontent.fcai19-7.fna&oh=00_AfAaQigw-2d9sBSwPZEgNlvzbhudo4-_HZRWbOHTgbXvBQ&oe=64E3CBF3 https://scontent.fcai19-7.fna.fbcdn.net/v/t39.1997-6/11409221_787327234698980_1017824016_n.png?stp=cp0_dst-png_s110x80&_nc_cat=1&ccb=1-7&_nc_sid=ac3552&_nc_ohc=oQws0WUVDMMAX-EUzLa&_nc_ht=scontent.fcai19-7.fna&oh=00_AfD1drAK5bAsRGi1CeGxKLYKtMEXO6E7DeuWIXDPj32lxQ&oe=64E2CED0,https://www.facebook.com/MetaAI/posts/pfbid0adb3c8obS9yBnrYVZSZG8Pa7MHpE2TaMZUj7qJPwyVmgGaxCvpPyD4tpt3VUUHN3l?__cft__[0]=AZVlKYTl1IrMEWwIZHL4fGvuuzBZ0c61ZHuqjxJ-jwdXSxCLQSmb0YJG8Qpm759R-idZe7bITyYd69Z78bP9rQ_jYQe9OVGlBhWG4YPQmLZeyKExpqltLNVE-IZHrGNv5iMDMgFJZ1BwPLOiyhNLQk_b7QAEv6PlPSmJ_h-XSM7voHuIs6m3ki13tl640VOe6tOlAgxscScmwWoAluSvsdBk&__tn__=%2CO%2CP-R,117,0,positive,117
pfbid0HBRomovMJnrMAoBNyWwxW85fQqSkxfuhMjz9d5wba6jDC7xHcTYaaSK3vrajTKikl,Meta AI,17,85,13,0,0,0,0,0,98,6,"The team behind Meta AI’s open source Detectron project has received the PAMI Everingham Prize for contributions to the computer vision community. Meta AI researchers Ross Girshick, Kaiming He, Alexander Kirillov, Wan-Yen Lo, Ilija Radosavovic (now a PhD student at UC Berkeley), Yuxin Wu, Georgia Gkioxari, and Francisco Massa discuss how the project came about and what’s next for Detectron.",2021-11-22T00:00:00,['https://video.fcai19-7.fna.fbcdn.net/v/t42.1790-2/258765069_1181470115595114_2331827376811669149_n.mp4?_nc_cat=101&ccb=1-7&_nc_sid=985c63&efg=eyJybHIiOjM0MiwicmxhIjo1MTIsInZlbmNvZGVfdGFnIjoic3ZlX3NkIn0%3D&_nc_ohc=bq3YtrKauqwAX91NuFo&rl=342&vabr=190&_nc_ht=video.fcai19-7.fna&oh=00_AfDqKgzvGdU4KMYaGRGYqoQXHw09qVMnoeVEpyUGdfyNog&oe=64E3A851'],https://scontent.fcai19-7.fna.fbcdn.net/v/t15.5256-10/258645007_598709581446830_3668294304849414740_n.jpg?stp=dst-jpg_p180x540&_nc_cat=110&ccb=1-7&_nc_sid=ad6a45&_nc_ohc=KfyAzh8oK4EAX9V1q6j&_nc_ht=scontent.fcai19-7.fna&oh=00_AfAZCADi4Vz_AVG6gT6YtEdaQTKg3DdsqW78gUITW69qew&oe=64E390BD,https://www.facebook.com/MetaAI/posts/pfbid0HBRomovMJnrMAoBNyWwxW85fQqSkxfuhMjz9d5wba6jDC7xHcTYaaSK3vrajTKikl?__cft__[0]=AZUwa-JaD3yIuB3RY-UQh59VxAsXAoJ8483NS0dbSYsIQHSaGBkwVh7hINiIDL_ttgq70YquVxbQTsWmIUVCD1iDkVVoulY-osY6gnrhv5IQXKiCIGQX34mtVJA6XpxcspYV-DY00ZQq4MrawFcEc0aoF0pZG8jtgBTP2DQYTwEGt5IpkNDriOVmzf_Vpu1Og84mcOoBYfs9d9HwfmTyaBglbON0aQcczzr_StGIeGJxVg&__tn__=%2CO%2CP-R,115,0,positive,115
1978629062314037,Meta AI,5,99,9,0,0,0,0,0,108,10,"How far are we from universal, real-time translation? We sat down with Philipp Koehn, a Meta AI research scientist and one of the inventors of the modern method of phrase-based MT, to dig into promising directions on the path toward universal translation.https://ai.facebook.com/.../qa-with-machine-translation...",2021-11-19T00:00:00,[],https://scontent.fcai19-7.fna.fbcdn.net/v/t39.30808-6/259037127_1978629058980704_6365368198253546769_n.jpg?stp=dst-jpg_p180x540&_nc_cat=103&ccb=1-7&_nc_sid=2c4854&_nc_ohc=cKwnoDWq0FMAX-P6dr5&_nc_ht=scontent.fcai19-7.fna&oh=00_AfAdnH_x13NS9aBoAiUlxQ7UQZL162TcI7MEetqn9K2SLg&oe=64E34803,https://www.facebook.com/MetaAI/photos/a.360372474139712/1978629062314037/?__cft__[0]=AZXWahNC_h748W3AnfmpOGuZ75vOc44dgPg7Rjg_jzm-QNNnqXXfoHkfNEBBk4qbl6UZihZfE38hrABUz4eUdtlSAxFsyOH-gOF5AM-SsFPgmdkJ8InudfmHkkC-OuM0K5yUvenGVMtebb1MNf1uSR1mmm1gn9qfBpjQMuxl-8oR1m34CXmwlsQRqBnecTNHJzTh4dc-W2xhTmY_ZbXWWffb&__tn__=%2CO%2CP-R,113,0,positive,113
