id,name,shares,likes,loves,wow,cares,sad,angry,haha,reactions_count,comments,Summary,posted_on,Video_URL,Image_URL,URL,Positive_Reactions,Negative_Reactions,Sentiment Analysis,Rating
pfbid0xzTXr3vPfUk8qXurFvePcbyg5WVmWKtFUFnvNjyhgpZbtZnVjsaFGqrKt17HN5k4l,Meta AI,81,281,21,0,0,0,0,0,302,6,"We are sharing Generalized Data Transformations, a new self-supervised, multimodal framework for understanding the content of videos. It sets a new state of the art for video action recognition, retrieval and few-shot learning, and audio classification. https://ai.facebook.com/.../a-state-of-the-art-self.../",2020-06-25T00:00:00,['https://video.fcai19-7.fna.fbcdn.net/v/t42.9040-2/105955991_1351053831765154_8118741946811028175_n.mp4?_nc_cat=105&ccb=1-7&_nc_sid=985c63&efg=eyJybHIiOjMwMCwicmxhIjo1MTIsInZlbmNvZGVfdGFnIjoic3ZlX3NkIn0%3D&_nc_ohc=0j5fMksvYTAAX_zozF7&_nc_oc=AQlMHrWZM-aLtS2GDxv9brxJqA_UNZjbZ46qbWaPxDjN6OMhvl8B9ncr8u6isvccUS8&rl=300&vabr=68&_nc_ht=video.fcai19-7.fna&oh=00_AfCbJreBkSLaaBLDrtaVLgQTT1i7SRoQwYQ5kYeN_Ah02g&oe=64DE6B97'],https://scontent.fcai19-7.fna.fbcdn.net/v/t15.5256-10/106276020_195855998427054_3233011079915183086_n.jpg?stp=dst-jpg_p180x540&_nc_cat=110&ccb=1-7&_nc_sid=ad6a45&_nc_ohc=kUNCeY00eMIAX_1kxrJ&_nc_ht=scontent.fcai19-7.fna&oh=00_AfA0e5VbKNWfwY714dHkZfTb3NPXf5b_HyOEJAuL3Mesfw&oe=64E43AAC,https://www.facebook.com/MetaAI/posts/pfbid0xzTXr3vPfUk8qXurFvePcbyg5WVmWKtFUFnvNjyhgpZbtZnVjsaFGqrKt17HN5k4l?__cft__[0]=AZWmZgBuA4WM29BKJp1G_UY5UyC8jl4jWGWqUss1rWDdGKPqaEn3isHdTE0N2el_mwYHDU1Gy0XheRhdUaPchqYWiz2TZvW8OS5LPdOtJvwx7F6buSpn5vxxFk4SpnABhu9SBKnvfvceWoOcR8kyQZkWuUJR25x1NgBIWGLUZBdFI6UoMShWleptE1u3BbxDxIpEoMm1E-P9bbqZLNaVdvNpz8XCFNq5Buov85g-PEaw-A&__tn__=%2CO%2CP-R,383,0,positive,383
pfbid02wpdweyLBiMUowDx5Wio9c13ye88tmVLRWP8wAccpgrCGRVYfGCzpCLeXKLj8Vumsl,Meta AI,129,338,25,24,0,0,0,0,387,20,"We are sharing the NetHack Learning Environment, a fast research environment based on the procedurally generated single-player terminal-based game NetHack, to help researchers test the robustness and systematic generalization of RL agents: https://ai.facebook.com/.../nethack-learning-environment...",2020-06-25T00:00:00,['blob:https://www.facebook.com/f40f0d69-0e5e-45cf-8198-5ed45b21f39b'],https://scontent.fcai19-7.fna.fbcdn.net/v/t15.5256-10/105700884_2325594084415184_1905401517475356036_n.jpg?stp=dst-jpg_s960x960&_nc_cat=109&ccb=1-7&_nc_sid=ad6a45&_nc_ohc=D9e2RBEBWY8AX8lxJ7V&_nc_ht=scontent.fcai19-7.fna&oh=00_AfBroRkFUIKQ9uWUqCkIshrwtfW33x7Ye_kQa76WXga9ug&oe=64E420C5,https://www.facebook.com/MetaAI/posts/pfbid02wpdweyLBiMUowDx5Wio9c13ye88tmVLRWP8wAccpgrCGRVYfGCzpCLeXKLj8Vumsl?__cft__[0]=AZUSIxMJW1jnZ17BmxOkSnLI88WC22gzDL16qjS9yRMJKCfODO_UtShNAAAsX3u9c-vH06slaoi2geB6CMFVThhbHFoRTkis3v-nvtE1-ZDmzENDXngLpz99PjXFQscobtysuBDHBNoyi3hQMn7Mo7u_Te6z3KF8OLyvzLzNsPFJ0VT7BLAU1QR47tZD8QS2R2FglVJHh-v3pRMvT5LL7o6HTTmuCWAGSUmqNvzVaOpaWg&__tn__=%2CO%2CP-R,516,0,positive,516
pfbid02Fs6BAA6pnSwxdBprUdTr5ix4x79JSqUopNuGcuvETii5VuwYGSVbNVCW2G6FRfual,Meta AI,51,228,18,0,0,0,0,0,246,12,Facebook AI is building models to help local officials and health-care providers better predict the spread of COVID-19 as areas begin to reopen. We’re partnering with the University of Vienna on district-level projections for Austria. https://ai.facebook.com/.../using-ai-to-help-health.../,2020-06-18T00:00:00,[],https://scontent.fcai19-7.fna.fbcdn.net/v/t1.6435-9/104258005_1554882894688658_761977789064328474_n.jpg?stp=dst-jpg_p843x403&_nc_cat=104&ccb=1-7&_nc_sid=730e14&_nc_ohc=jphaxhS7E84AX8nx5pW&_nc_ht=scontent.fcai19-7.fna&oh=00_AfBnXOaejp8GSSBce0frIV8HkQA2llBq_-8pt4jprginlg&oe=6505C677,https://www.facebook.com/MetaAI/posts/pfbid02Fs6BAA6pnSwxdBprUdTr5ix4x79JSqUopNuGcuvETii5VuwYGSVbNVCW2G6FRfual?__cft__[0]=AZUKXrj_PtnYQlDANAN3Sa53tRR5o_azqHkUpqlJ-9ofI29jKzn_p9cd4p9gluGIy4WedVe30jwoFxPv8wKXDMFKmm2f23K6lmj7YMHsGcVJ4zZ5zknjocQRhy3rRUMMshriPdbMq87-ZC0ScO2wMNhuwUvypIo7Fi7aFuqojmwZlEmmpDLbLrGmuxQ9L5oa7ReB2iPUsqW4HOo7kGDvZqG6&__tn__=%2CO%2CP-R,297,0,positive,297
pfbid0Am2EQiGsZixVxgLAPUfuRUvtn7VwUepukJFqQ3zEf3jCctXVeuKcUdncFQxmmbBUl,Meta AI,109,384,37,33,0,0,0,0,454,22,"We partnered with the Max Planck Institute for Evolutionary Anthropology (MPI EVA) and the Pan African Programme: The Cultured Chimpanzee on an advanced framework for dense pose detection for chimpanzees. It will help primatologists, ecologists, and other scientists accelerate their research. https://ai.facebook.com/.../dense-pose-for-animal-classes...",2020-06-17T00:00:00,['blob:https://www.facebook.com/b0bba261-b626-4096-95ab-4a7cf4cd265a'],https://scontent.fcai19-7.fna.fbcdn.net/v/t15.13418-10/104383036_3044596775575938_4962750909919707388_n.jpg?stp=dst-jpg_p180x540&_nc_cat=103&ccb=1-7&_nc_sid=ad6a45&_nc_ohc=IUPEQ9BqHZgAX9FKxLc&_nc_ht=scontent.fcai19-7.fna&oh=00_AfAzpWBqPdthDiYkG9zCdX5DDlTQj7Vsnz6Rg9cMiUlEGQ&oe=64E24217,https://www.facebook.com/MetaAI/posts/pfbid0Am2EQiGsZixVxgLAPUfuRUvtn7VwUepukJFqQ3zEf3jCctXVeuKcUdncFQxmmbBUl?__cft__[0]=AZXHHvRk2Qb6uiAHDJeh2UDl6R6huMru42ciwYQ7qZtUxHI9xmC1Mc9hSb9-vfgrLYxmjlzyiQJPX1r2j75tlXoXqvSoV2Zr0Og0If151qgN3FCtAe9xhuwIAEtrZBdE-ynkP2vSvad70cDrzgFDZLtlitWhe87tuBWFCuIae8mFohpwXPmNIxkaLr2JlJp9ReFVuHXC3szUZHxePAjRIF35MlQ8rgtfWQHL_fALCfmlyA&__tn__=%2CO%2CP-R,563,0,positive,563
pfbid0NKgVeXjxXHASE6ntwaSyV2VUxGZKKWUCEF1p4oEBKhycJfyWNc4eXfrA8sRuZ8yNl,Meta AI,368,706,118,0,0,0,0,0,824,31,"PyTorch3D is an open source library for 3D deep learning. It includes support for easy batching of heterogeneous meshes and point clouds, optimized implementations of common 3D operators, as well as a differentiable renderer for point clouds and meshes. As part of CVPR 2020, we're hosting a tutorial that takes place tomorrow. Details here: http://s9xie.github.io/Tutorials/CVPR2020/Read more about PyTorch3D here: https://ai.facebook.com/.../-introducing-pytorch3d-an.../",2020-06-15T00:00:00,['blob:https://www.facebook.com/db0f6fa1-b97a-4703-a33f-d06e2f4fc76c'],https://scontent.fcai19-7.fna.fbcdn.net/v/t15.5256-10/103829391_282555493116458_6717308446068754018_n.jpg?_nc_cat=100&ccb=1-7&_nc_sid=ad6a45&_nc_ohc=CvXFQBhdDdsAX_pri1R&_nc_ht=scontent.fcai19-7.fna&oh=00_AfAol59A-pb-6VSa_vKIyN8gJUovDGQdiVXrRqeIX8Gs5g&oe=64E33C3B,https://www.facebook.com/MetaAI/posts/pfbid0NKgVeXjxXHASE6ntwaSyV2VUxGZKKWUCEF1p4oEBKhycJfyWNc4eXfrA8sRuZ8yNl?__cft__[0]=AZWpUifxeJ7Dov81YcePbmFDomzdOw9Kt3_fHPTAi5n5wDE6fejM1ziCSADUlvhApAN2fYXrbPKqfkclPMRMk-K1fJr2vczaoJ4igU84sas5sta2BMsUHj4Gc5QDyeQixinmNJPsc7ucOy-kZzJJSx9bE0LzYYvMBG66fyEDnC9XyqE87Xr1yGS3_JbgBWpHypi8ZCRNKNvaCd75QmWdn6ljqCvt12KKC5JWvElQr8QrCA&__tn__=%2CO%2CP-R,1192,0,positive,1192
pfbid0zJuSNgbXgc5HW4LcLwNMDPVQY7r67rUBzFZ7G7roVCpJyfHiGWs3Kk319ABvjoyql,Meta AI,437,711,70,68,0,0,0,0,849,25,"At #CVPR2020, Facebook AI is pushing the state of the art forward in many important areas of CV, including core segmentation tasks, architecture search, transfer learning, and multimodal learning. Read more about our presence at CVPR this year: https://ai.facebook.com/blog/facebook-research-at-cvpr-2020",2020-06-12T00:00:00,['blob:https://www.facebook.com/f0aa532c-f63b-4580-94e0-01c79c2ebfd0'],https://scontent.fcai19-7.fna.fbcdn.net/v/t15.13418-10/102706490_3004110846324046_5790100363427722294_n.jpg?stp=dst-jpg_p180x540&_nc_cat=109&ccb=1-7&_nc_sid=ad6a45&_nc_ohc=2_mp0YcgNSkAX_PcSGs&_nc_ht=scontent.fcai19-7.fna&oh=00_AfDTMNdMWEKKHRF5FiNN1d_hv5ypn8MEem8UetXhKV1LKA&oe=64E29060,https://www.facebook.com/MetaAI/posts/pfbid0zJuSNgbXgc5HW4LcLwNMDPVQY7r67rUBzFZ7G7roVCpJyfHiGWs3Kk319ABvjoyql?__cft__[0]=AZW-cWEwryG_Nq67ZiAYD09zlmh5SI-gIgsabqkICXgAphjBXXgfHT7Ov5K4Cy7Kx_sg0bUO0QtBfjSTHowHS8cAKfBCQfsNtbE5QD_tvqzrP72U7VvQYv-x5wspiEo3h3XTWxYI7w2OcfnnixwYhGI5axavgmx7kpbOMMem8ymj87ZSTdaVVmG23BrVBvikG2hiT3JfPO8cPB7z1Nf61m3IdDr3nYv-jZDk_gVOr_X80w&__tn__=%2CO%2CP-R,1286,0,positive,1286
pfbid02ve43pTicrhq2ak1HaayDy13UJzgzbhHxi8wHMWc6VkhgKYJpjosfGZFG7okLYNgAl,Meta AI,73,235,18,0,0,0,0,0,253,6,"2,114 participants around the globe entered the Deepfake Detection Challenge. We’re now sharing the winning models and insights from this first-of-its-kind open initiative to address the challenge of deepfake videos and images.",2020-06-12T00:00:00,[],https://www.facebook.com/,https://www.facebook.com/MetaAI/posts/pfbid02ve43pTicrhq2ak1HaayDy13UJzgzbhHxi8wHMWc6VkhgKYJpjosfGZFG7okLYNgAl?__cft__[0]=AZU5r4TXPwLu7EHmSQeM_mh20L7saTv9wA90P5U8gSYW0JaTo9Lt05D63_D5yBeRWHFAlSu4Svb_chaSo2nFs_sXXhVHUyXVS8QvkA6dmRXIVae3JIM36kuwfzopEvwqBhw8q1wYWMbNfbUcmYBxS4qYTzav366LFauQq9nSP-x4OquS7Zsm0SnqdqClAhPx3xEUfGgAxVTdCtZk-GczV2e9&__tn__=%2CO%2CP-R,326,0,positive,326
pfbid02hQk4EWx68idpRuLTH5tkExgezkwDC5CDXrwShkUdSCypyzqUHxgeY22tDgK7pJRvl,Meta AI,49,164,15,0,0,0,0,0,179,8,"We’re sharing how Detectron2, a PyTorch-based object detection library, is being used to train ML models with geological imagery. https://ai.facebook.com/.../how-detectron2-helps-make...",2020-06-09T00:00:00,[],https://scontent.xx.fbcdn.net/v/t39.2365-6/103463048_1145651702459982_7493269329922717681_n.png?_nc_cat=106&ccb=1-7&_nc_sid=e280be&_nc_ohc=nU0r0L_pPOsAX-6i6mg&_nc_ht=scontent.xx&stp=c0.5000x0.5000f_dst-jpg_flffffff_p500x261_q75&ur=139b9a&oh=00_AfAQJVWVFr2VxYj3ftS_ZMATWFO2yBlOdMh2QDEqZhZ4Qw&oe=64F33182,https://www.facebook.com/MetaAI/posts/pfbid02hQk4EWx68idpRuLTH5tkExgezkwDC5CDXrwShkUdSCypyzqUHxgeY22tDgK7pJRvl?__cft__[0]=AZWQ-Gemtc1AS7cUxcCh1EvS2WHGol-Mkr2nirc4wQC17h5I7fEaUPhkRWcBtiNii_yhR0hmgk_CyL2uxqUD1fFM8_qoYZuA15HfII3d-Yse-Ws6YB5klcT2SvfBmeK89mtCe3Pv4qSUS14l7wzn29nI_FzbJJIhusNB1diYNOn_d88FGpbXJgiGTPmi-9NiNwC7CBt_y1-2s7t_3DTdS3Dq&__tn__=%2CO%2CP-R,228,0,positive,228
pfbid0vDhavVK3GL8jz7HsvbrvhmoWtJnEVbEx18p39Kt1fHiri7vHMnhPJFbfBguaeW5El,Meta AI,31,109,0,0,0,0,0,0,109,2,"We show how several simple, infrequently explored design choices in pretraining can help achieve high performance on tasks that combine language and visual understanding. Learn more here: https://ai.facebook.com/.../analyzing-pretraining...",2020-06-01T00:00:00,['https://video.fcai19-7.fna.fbcdn.net/v/t42.9040-2/101024490_2372074973086093_4003853691122614272_n.mp4?_nc_cat=103&ccb=1-7&_nc_sid=985c63&efg=eyJybHIiOjMwMCwicmxhIjo1MTIsInZlbmNvZGVfdGFnIjoic3ZlX3NkIn0%3D&_nc_ohc=8NOb6Bww04gAX8CP3kV&rl=300&vabr=38&_nc_ht=video.fcai19-7.fna&oh=00_AfC-v0TXiMXWaKP4yBNI6yWvdzost32RfqL96qAHIW1d6g&oe=64DE7757'],https://scontent.fcai19-7.fna.fbcdn.net/v/t15.13418-10/77368634_579116339702525_5807965969506631680_n.jpg?stp=dst-jpg_p180x540&_nc_cat=101&ccb=1-7&_nc_sid=ad6a45&_nc_ohc=UP08_YKnK5EAX8-kdZZ&_nc_ht=scontent.fcai19-7.fna&oh=00_AfAJAHM242M2hmftxdTi7cOOjlVROxgBWE82aoQGVFcFWg&oe=64E40003,https://www.facebook.com/MetaAI/posts/pfbid0vDhavVK3GL8jz7HsvbrvhmoWtJnEVbEx18p39Kt1fHiri7vHMnhPJFbfBguaeW5El?__cft__[0]=AZUiN0Q1H8dIFneQvZmUpB4SimJmMK5Zg2317U8L9DP9W10XT2gAlxc-WATB6l4Py5QDyoqT23wWRKhmz654Vz_ZurKqBVl0NDBhBEQIwgFgVoBRkgMY3jwUgCtYDiGdz18GsOW4AnB4Ua7P4k2BTYZHouB0OXbDZETOUoDUHFgSHiXdYQlrMTCGG7HvC9Fi7S_cpBqL_td9xOEVU3vc6WOnChSbABJ1a4UhiW4Yhtwf3Q&__tn__=%2CO%2CP-R,140,0,positive,140
pfbid02P8Xmy1z1XC1v82HrCFZyjgDL7hwjcxNeUf9ySm3UBw3mHqnP249cTCjWMwpgQzSvl,Meta AI,201,423,31,30,0,0,0,0,484,14,"We are releasing Detection Transformers (DETR), an important new approach to object detection and panoptic segmentation. It’s the first object detection framework to successfully integrate Transformers as a central building block in the detection pipeline.",2020-05-28T00:00:00,[],https://www.facebook.com/,https://www.facebook.com/MetaAI/posts/pfbid02P8Xmy1z1XC1v82HrCFZyjgDL7hwjcxNeUf9ySm3UBw3mHqnP249cTCjWMwpgQzSvl?__cft__[0]=AZWV4Qawjw_zXDavRkNIndJGee4n_vMzH5xMlmMwabecllCThDXPIqDZ_VrP4C729EZmpPLzbwHuPCdbmK6EueNRVBZot4NDrMjqFc6YoL89x6VZobmW7ccsW4bifPrcsONIURVwO185pX2ESo1hc_FpG1chW241BECcxFMr9BNFzgBFf1EJ6FOcp3Sy6PqhqDV-670kIWjOQzBFTyUuxc0K&__tn__=%2CO%2CP-R,685,0,positive,685
pfbid036LNmszrB2qrrg5Yn1XgtBzPdVbJ3qFRRdu2Aj3kTUSZa5vYeLNXL3zGS7uN6mLu1l,Meta AI,788,808,170,142,0,0,0,0,1120,97,"Today we’re unveiling advancements of our AI-powered shopping system that leverages state-of-the-art image recognition models to improve the way people buy, sell, and discover items. This includes a new a universal product recognition model that can identify fine-grained product attributes across billions of photos — in different categories, such as fashion, auto, and home decor. This work is foundational to transform the way people shop on Facebook. Read more: https://ai.facebook.com/.../powered-by-ai-advancing...",2020-05-19T00:00:00,['blob:https://www.facebook.com/92b67c7b-76a9-4d4b-a66b-293c24638fd8'],https://scontent.fcai19-7.fna.fbcdn.net/v/t15.13418-10/99236636_2260290700944239_1201761935666708480_n.jpg?stp=dst-jpg_p180x540&_nc_cat=100&ccb=1-7&_nc_sid=ad6a45&_nc_ohc=9G_eR7pNlJoAX8JW2ND&_nc_ht=scontent.fcai19-7.fna&oh=00_AfAKx5u2Qgea3idLxqToxKwntAhuhPUOP10CVDVmo5Yqmw&oe=64E28428,https://www.facebook.com/MetaAI/posts/pfbid036LNmszrB2qrrg5Yn1XgtBzPdVbJ3qFRRdu2Aj3kTUSZa5vYeLNXL3zGS7uN6mLu1l?__cft__[0]=AZXepGMpepAXIX-lFhFX7yp_677T84tE_FQgZFzRkPE_YARdJ0BmhAayUhDpTjW8UuQI9VlD98dY18GxvJvfrF5C3vKYuckjNNG1o7RiW3NHvk5ZBaLcs-uUbBM5kTG0_NbNjM2HyOzz-N-flqrKHhM4v3agYeRrhOMSs-A_EpZOOZpwtWWQl8EdrW_0QVzpCQEhAOPeov5NeosPrJ6ufcOzM0BSR8yssoN4eFSaHdfGcg&__tn__=%2CO%2CP-R,1908,0,positive,1908
pfbid028GRi7A76yLceBZ5fkqg5dYeYE6QRbdPgLFyZzSRYtvHKJrpLWMHNXrZzymGgVyhrl,Meta AI,40,171,23,21,0,0,0,0,215,7,Text-to-speech (TTS) systems across the industry typically rely on GPUs or specialized hardware to generate state-of-the-art speech in real-time production. We solved core efficiency challenges to process one second of audio in 500 milliseconds — using only CPUs. Below is an audio sample using our neural TTS system. https://ai.facebook.com/.../a-highly-efficient-real-time...,2020-05-15T00:00:00,['blob:https://www.facebook.com/cea17759-2d25-4682-8847-42e07daaf206'],https://scontent.fcai19-7.fna.fbcdn.net/v/t15.13418-10/98202310_235912814501762_3642389664398049280_n.jpg?stp=dst-jpg_s960x960&_nc_cat=110&ccb=1-7&_nc_sid=ad6a45&_nc_ohc=YTxOp-T2Ln8AX9T3u5j&_nc_ht=scontent.fcai19-7.fna&oh=00_AfA2p6LV_hNdCibeMnzMqqcK7TbcsVuZsrWwVC3UvDDHWw&oe=64E32AAA,https://www.facebook.com/MetaAI/posts/pfbid028GRi7A76yLceBZ5fkqg5dYeYE6QRbdPgLFyZzSRYtvHKJrpLWMHNXrZzymGgVyhrl?__cft__[0]=AZVafxT42XNzPAiI4n09-fcIX-F6m8PX7S_jdF0tGW4IPtqU4MkMSxxwBpQLDES7fVDjQwAPGvgyLfgBbaXMrrFJ159RbzEMFVbb_b8ai_WN1j2LV6YDY7a8Sh_6ipr0W-_pIj6ZGDLuT57-t-4jDYdyVOgTzLAWFs9JTIoYECjGdKdWtk5ywFuk37PQXzmbdJ2PENb5qPNxYAbs4uAoQ-zq9h_aA2DUMlvkL4uTkEj7mA&__tn__=%2CO%2CP-R,255,0,positive,255
pfbid024H1bNwTmbctPX8CfMJAaW9TBpxBnC8UAwuowPXhSSNarEfNdYBFFd3Ed5eUy7jiLl,Meta AI,26,144,8,0,0,0,0,0,152,12,We’re sharing new details on our AI tools to help us detect and deal with hate speech on our platforms. https://ai.facebook.com/.../ai-advances-to-better-detect...,2020-05-12T00:00:00,[],https://scontent.fcai19-7.fna.fbcdn.net/v/t1.6435-9/96232380_1523337907843157_8368229243468906496_n.jpg?stp=dst-jpg_s640x640&_nc_cat=101&ccb=1-7&_nc_sid=730e14&_nc_ohc=IVGihYwGKrAAX8FFQU-&_nc_ht=scontent.fcai19-7.fna&oh=00_AfAmh5rlO9gwo7-bhgpjuf67SvR4uk8hhRnOKwruFr-_PQ&oe=6505C1FD,https://www.facebook.com/MetaAI/posts/pfbid024H1bNwTmbctPX8CfMJAaW9TBpxBnC8UAwuowPXhSSNarEfNdYBFFd3Ed5eUy7jiLl?__cft__[0]=AZXHsvsdLn4Bd1-MDW2-eeCKD-89sLKhTySKbIQ4WBvXGkgrs-QJ4Ck1rC3bLTVgaXKQ2aNDpk4df-BWIFgwnif1aplK-xaiyp5_YAoXg_wiSYhLzgYb91QY_aXlNSTkU_E505GJqKaoGj6SoY3knh1_mFUq2V0qxGW7X7WQLeBBxzJwvpPhAJKs-ZiaVaDD7CLX8QGDGxU3jr1gSUrwrm1Q&__tn__=%2CO%2CP-R,178,0,positive,178
pfbid029MYsNJLqZxHKEDDydrv28fNa817ypZcBQzZe99JSou8JJyM66GKhkuAE8bELbsmKl,Meta AI,44,206,12,0,0,0,0,0,218,7,We’re sharing details about how Facebook is using AI to help detect COVID-19 misinformation and other challenges related to the pandemic. https://ai.facebook.com/.../using-ai-to-detect-covid-19...,2020-05-12T00:00:00,[],https://scontent.fcai19-7.fna.fbcdn.net/v/t1.6435-9/96515815_1523335841176697_7034022039790813184_n.jpg?stp=dst-jpg_s720x720&_nc_cat=108&ccb=1-7&_nc_sid=730e14&_nc_ohc=ZlJ-mDW4-uMAX__VFmg&_nc_ht=scontent.fcai19-7.fna&oh=00_AfDwoQKhxs3CS1BIgKBgsidMZtVCflDSeyigoLZMqc0lGg&oe=6505CBCB,https://www.facebook.com/MetaAI/posts/pfbid029MYsNJLqZxHKEDDydrv28fNa817ypZcBQzZe99JSou8JJyM66GKhkuAE8bELbsmKl?__cft__[0]=AZVxLsuj14nEcNRGyqtDjjm6P2LCrvnEZymfUTDK8f-XFJBmtXHFq2-Y8yWbj7h3rnGNYxoE3IvsMclF5yA8CDAJpe92RPt8CzwcU_DuWT-b8PjVZGgVr2cI0RSaBvSthea6nBqAif9_zwaOXfiND6-qi2-Ri0wAXittLK5zUvIs6tRGRxJd5Mor1LTfvlgcCKQJfb76Pu4n3KTJP05UmcLk&__tn__=%2CO%2CP-R,262,0,positive,262
pfbid02g2URsZDjnRkGtNjMHLhMA9exThvQNfeFL6zpMza8jBGA2x9ACZ4qWki14UGSoQ7Ul,Meta AI,59,140,0,17,0,0,0,0,157,28,"We’re launching the Hateful Memes Challenge, a first-of-its-kind competition hosted by DrivenData with a $100K prize pool. We’re also sharing a new Hateful Memes data set designed specifically to help AI researchers develop new systems to identify multimodal hate speech. https://ai.facebook.com/.../hateful-memes-challenge-and...",2020-05-12T00:00:00,['https://video.fcai19-7.fna.fbcdn.net/v/t42.9040-2/98130184_166881421408559_7588542114871377920_n.mp4?_nc_cat=111&ccb=1-7&_nc_sid=985c63&efg=eyJybHIiOjMwMCwicmxhIjo1MTIsInZlbmNvZGVfdGFnIjoic3ZlX3NkIn0%3D&_nc_ohc=9ufT6uj7-DsAX-tVvbg&rl=300&vabr=71&_nc_ht=video.fcai19-7.fna&oh=00_AfCsY196gT5qeZQcAw-O7tdEsGJPg_5B-sYiSf_ohMOI7w&oe=64DE6D38'],https://scontent.fcai19-7.fna.fbcdn.net/v/t15.13418-10/97508588_178167390104413_1107811836759113728_n.jpg?stp=dst-jpg_p180x540&_nc_cat=105&ccb=1-7&_nc_sid=ad6a45&_nc_ohc=62W3sYy7vJQAX-AAu11&_nc_ht=scontent.fcai19-7.fna&oh=00_AfBzpiT5GjpUcBKAQrn2lUW5NflP5E6U2deYqcCH91lpFw&oe=64E3DEBF,https://www.facebook.com/MetaAI/posts/pfbid02g2URsZDjnRkGtNjMHLhMA9exThvQNfeFL6zpMza8jBGA2x9ACZ4qWki14UGSoQ7Ul?__cft__[0]=AZVlYF2JN8ui2iZZpomqXwN-TYkEe15fgwPkXo-N_fJAbzS5RHMV1-WG-oMGnd6C_u86nu2UG7AwKj17oq8JQEpM4oZQAI9XPmhjgQYhE112GqQLCfdDqvclQTfEEIlGhh_1XLI32VbddBIJMxb7KwMUgbuCtclBmSaWmJS4XHCvIfATE7N_JeBIXOe3mNd9u12SbEJuaPAizL9QQ7Bsz676VNwuBVIhskA5eQhGH_gNpw&__tn__=%2CO%2CP-R,216,0,positive,216
1516416918535256,Meta AI,51,210,12,0,0,0,0,0,222,12,We’re working with collaborators at Radboud University Medical Centre (Netherlands) and Erasmus Medical Center (Netherlands) to propose a new gigapixel histopathology image classification pipeline based on CNNs. This method leverages multitask and transfer learning approaches to mitigate the low signal-to-noise ratio problem in histopathology images. https://ai.facebook.com/.../using-multitask-learning-to...,2020-05-04T00:00:00,[],https://scontent.fcai19-7.fna.fbcdn.net/v/t1.6435-9/95493044_1516416921868589_4482567322845839360_n.jpg?stp=dst-jpg_p843x403&_nc_cat=106&ccb=1-7&_nc_sid=9267fe&_nc_ohc=zGqmBchrkKAAX-2A9Lv&_nc_oc=AQmdqfpFdIJiMUa02An4H_fcYm4cRUkbkprWYXapJkD8YdllqQ8lFHzDeECElNJF9LA&_nc_ht=scontent.fcai19-7.fna&oh=00_AfCcJPpC483ZA9Z2xFpDTgcTeJGdDY7PQSR0agMN8qI41w&oe=6505D3F3,https://www.facebook.com/MetaAI/photos/a.360372474139712/1516416918535256/?__cft__[0]=AZWabMAB61FAgrQfYRBj8xhL-Mb587NBskVJL4W1rsjVS1r_Z-SsmZmmvv5_B8ix0aFEB3SMGKM2uQFjPz_YeP7t4ZlrT6NxxBBe95tHsTayrqRVJmF5Qy8ZfEBVMD3hWUiKlJQck1TtfIbvUZ2OoW5Wk0eaGv5AohY2qU0eQedMv8MQzP3y0uXiIPBeQYezXiTqLIUsf-8Q-Gu9qW8-ISKI&__tn__=%2CO%2CP-R,273,0,positive,273
pfbid02kMmR98WFoPLWem3TCUQVfLv2VmRouGqDFMqmy7o2MNFcP3THuPiGXysGrmUxF6qUl,Meta AI,135,289,28,25,0,0,0,0,342,25,"Today we’re announcing that Facebook AI has built and open-sourced Blender, the largest-ever open-domain chatbot. It outperforms others in terms of engagement and also feels more human, according to human evaluators. https://ai.facebook.com/.../state-of-the-art-open-source...",2020-04-29T00:00:00,['blob:https://www.facebook.com/ea2586ec-2ac4-4d7a-adaa-819e954a817e'],https://scontent.fcai19-7.fna.fbcdn.net/v/t15.5256-10/95193796_2628095307466857_1227726116777623552_n.jpg?stp=dst-jpg_p180x540&_nc_cat=109&ccb=1-7&_nc_sid=ad6a45&_nc_ohc=g1u6zvEURDYAX_HzOMy&_nc_ht=scontent.fcai19-7.fna&oh=00_AfAkZeMuas3r-nBU3rFT_1qdY2Fa0KQ7p5HLm4zswAbaaw&oe=64E3CCA1,https://www.facebook.com/MetaAI/posts/pfbid02kMmR98WFoPLWem3TCUQVfLv2VmRouGqDFMqmy7o2MNFcP3THuPiGXysGrmUxF6qUl?__cft__[0]=AZVwmg-x_jLr7aPOqHKdrx-qhPQ-LkU29KBmPksJy4TpR80mf2pfdmE7hjWKSMVgKI8enKFbx4Ht4J0r30OCnp6OCP2tD8cy1DuKlpz4ATal1e1kffCwZCYm56VEW5z1GEbggqJaScqLxTc0OJ-tdCS1Xp_S4k6C_3vD1UNVHskFtdgNtrMi3Qwvduh7pisNtv8xjD89p94x93QvbEzHgnT0YhmXPPBa8e0MNJ6B1JkOnA&__tn__=%2CO%2CP-R,477,0,positive,477
pfbid0ppA8tdU5uxj4uUPnzrQ4K99YhNP8mtqqbvbfcYrHbtMcpdPm4qnh4KwRSoQfGDPsl,Meta AI,48,174,13,0,0,0,0,0,187,7,"We are releasing code and sharing details on Quant-Noise, a new technique to enable extreme compression of state-of-the-art NLP and computer vision models without significantly affecting performance.",2020-04-23T00:00:00,[],https://www.facebook.com/,https://www.facebook.com/MetaAI/posts/pfbid0ppA8tdU5uxj4uUPnzrQ4K99YhNP8mtqqbvbfcYrHbtMcpdPm4qnh4KwRSoQfGDPsl?__cft__[0]=AZXDRgpmueAtq4ASzmNkPEcdXVQrvqMhJ3Uhh8z-ZUrluYOypbWlZSP3IvoJARSpcytE4bvUiNq-vxTc_BXVUJwkPZYMlMMwtLmz7cLcqNHJ0tZ7TJPvA33ecHl5EJzkjcEY01GmH0jQ8_CXTrWasB5dR4wdowb_lLOBEjUAUOlE3jpeaOc0ks5ZIJArZHiz1mWjyANHFGfxRnWBfDjd12O5&__tn__=%2CO%2CP-R,235,0,positive,235
pfbid0EtC6kZ9JhJ1MBCeYMg9USKUMu5UywKckpLdTdG9Pbqwt2Mgx8wRqxcJEMpNxgLeLl,Meta AI,33,177,0,14,0,0,0,0,191,6,Facebook AI and AWS have partnered to release libraries that target high-performance PyTorch model deployment and large-scale model training. These enable the community to push the state of the art as model architectures increase in size and complexity.,2020-04-21T00:00:00,[],https://www.facebook.com/ https://scontent.fcai19-7.fna.fbcdn.net/v/t39.1997-6/851586_126362104215253_1651254063_n.png?stp=cp0_dst-png_s110x80&_nc_cat=1&ccb=1-7&_nc_sid=ac3552&_nc_ohc=1-_HcOjSQs4AX-zGsu7&_nc_ht=scontent.fcai19-7.fna&oh=00_AfBARbtFovL9uWZjeLiMlf3fDewkF6ncjAUCWQpjNW_WLw&oe=64E2E1A0,https://www.facebook.com/MetaAI/posts/pfbid0EtC6kZ9JhJ1MBCeYMg9USKUMu5UywKckpLdTdG9Pbqwt2Mgx8wRqxcJEMpNxgLeLl?__cft__[0]=AZWayrBDBw0kCnC-umdLVC0Mr2jMABy5z332UAmWnyfNJyp-jej6xy5SA1xlPEfbSQmeUdUV5pQo_XxWXnY17WW_vjowFO7dKl2nd7Pfk2Nr3Kiq-j_HY7DQYDZ51A-jde7XmnGfk2U2wFBBMfKtJRStsIzW2pokvnQ74YGtDtUv0ecFyNkfZEi6JNNRd0krzHCsqD2pWzI75UPdVTRcfryQ&__tn__=%2CO%2CP-R,224,0,positive,224
pfbid08hyy9ocXeMsQtUWgAdE7YguKe21pey8reKffjPTpXk3V5rrq5eBoCgv2nJndQxBUl,Meta AI,24,127,0,0,0,0,0,0,127,6,"Facebook AI is partnering with academic researchers and other experts on a range of initiatives related to COVID-19. We’re sharing information about several projects now, and we will continue to add information over the coming weeks and months.",2020-04-20T00:00:00,[],https://www.facebook.com/,https://www.facebook.com/MetaAI/posts/pfbid08hyy9ocXeMsQtUWgAdE7YguKe21pey8reKffjPTpXk3V5rrq5eBoCgv2nJndQxBUl?__cft__[0]=AZWXQ612NJb4ZxlUnJpNSQGBy1z0lkBZEB2vU6xJYZynTQbe6rN-RcS9kZMxWS3kpo90PHlR6Ayrkz5hiuE6WNwk7WtkAAn8Hxb5fBfoCFD4mQEfwy9ZoH6Iy7SfnLfcyP9m4e1VM4Bg9hBB3LiLmomwLsNTs4di4sBhn-qILdl5Xifx9k93-YNCxblEsweTwi2eCj58-DZLwkeGIO4UrY89&__tn__=%2CO%2CP-R,151,0,positive,151
pfbid0uc6fZeucTUF8U9NFRZdzc9UfitKcB33nuRgKkzymSgEsBPQ71gaE5QxTAJR3N9uWl,Meta AI,37,145,0,0,0,0,0,0,145,7,"We have added a range of noteworthy new features to Nevergrad, Facebook AI’s open source Python3 library for derivative-free and evolutionary optimization. Learn more and get the code.",2020-04-14T00:00:00,[],https://scontent.xx.fbcdn.net/v/t39.2365-6/92240084_2606384829607352_6573082108019867648_n.jpg?_nc_cat=106&ccb=1-7&_nc_sid=e280be&_nc_ohc=uATMG38TGAMAX-pbPyw&_nc_ht=scontent.xx&stp=c0.5000x0.5000f_dst-jpg_flffffff_p500x261_q75&ur=139b9a&oh=00_AfC7T8OOWsxQi73J0lP3fqLrKP76SVuHOiGdvAIOP7yadQ&oe=64F4EE16,https://www.facebook.com/MetaAI/posts/pfbid0uc6fZeucTUF8U9NFRZdzc9UfitKcB33nuRgKkzymSgEsBPQ71gaE5QxTAJR3N9uWl?__cft__[0]=AZW2_NwNa-ONK3UsXlUmUDpLUqfFxx1-U4bkCPsbYTDieR8XBtDZNPAQWpntWvVDEMY8TgYEuVdZGAAwuPYt2bvXfRS2Y1n7WkDSYXQKPngoySQszEFWGuen1PTA51J5Wzk06Ildvrj7PR8KBDDJNgG0EueaqFvytpHlMNIN7lkjjmumVXSofZtmvmDlpz6mxvPs5SvdxwES5WZs04XwviS6&__tn__=%2CO%2CP-R,182,0,positive,182
pfbid0vNYevuSnTi2BeYfVZHMgM58gzKJPDT66iAUSM8ccsjALgcjvBdRBbbJuGv3jWNbxl,Meta AI,44,194,17,0,0,0,0,0,211,4,"Today, Papers With Code introduced its new ML Code Completeness Checklist, building on the AI reproducibility work from FAIR Managing Director, Joelle Pineau. This new checklist will be a part of the official NeurIPS 2020 submission process.https://ai.facebook.com/.../new-code-completeness...",2020-04-08T00:00:00,[],https://scontent.fcai19-7.fna.fbcdn.net/v/t1.6435-9/92607381_1493596920817256_1780624386437414912_n.jpg?_nc_cat=103&ccb=1-7&_nc_sid=730e14&_nc_ohc=R0qFklXXP8UAX8KliRY&_nc_ht=scontent.fcai19-7.fna&oh=00_AfBH78ir-Myf2AJLDqI3ueFUdOyk5tKrN5GK7BbDOH_DPA&oe=6505C982,https://www.facebook.com/MetaAI/posts/pfbid0vNYevuSnTi2BeYfVZHMgM58gzKJPDT66iAUSM8ccsjALgcjvBdRBbbJuGv3jWNbxl?__cft__[0]=AZXAJ3I13K7eqHi3Siu029CHjLyEWG4v3a30UQK5czKTfh-f4jBloKsrZFo60Ml1tG1a_oD9gBuLy38Uq1Q-qdTV_Uq8na93jshOYIBLtNqARkXOVqiylZVNexgKShbFzEj_Cu7JjWnUyLoVhpvfFFgnpbh9-33JKsrlokN0dycMyJe3PdAiJo4lDLGZi6YvL-VOYyOJ6XpEGHNCyrInmNHt&__tn__=%2CO%2CP-R,255,0,positive,255
